년도,가수,제목,남녀,장르,최고순위,작사가,작곡가,소속사,가사
20000714,엑스라지,인연,male,댄스,-,이상민,JUSTIN ,-,사랑하는 사람아 그대가 떠날 때 내 슬픔의 전부를 가져가길 바라며 사랑하는 그대가 내 것일 수 없는 인연의 운명이라나 생각하며 떠나리 사랑하는 사람아 그대가 떠날 때 내 슬픔의 전부를 가져가길 바라며 사랑하는 그대가 내 것일 수 없는 인연의 운명이라나 생각하며 떠나리 멈칫멈칫 가끔 뒤를 돌아보게 돼 인연이라면 다시 찾아오겠지 나를 부르겠지 자유롭게 너도 꼭 한번 살고 싶었겠지 오겠지 날 찾겠지 이대로 영영 못 보면 어떡하지 I hope I see you I just don't wanna reminisce 자유로운건 저 높은 하늘에 아름다운 새의 화려한 날개짓 아름다운건 그대가 좋아한 한아름 수놓은 꽃들의 향기 좋아했던건 그대와 사랑한 그 날을 회상했던 나의 시간 지금 슬픈건 이 세상 한 곳에 슬픈 인연으로 혼자된 사랑하는 사람아 그대가 떠날 때 내 슬픔의 전부를 가져가길 바라며 사랑하는 그대가 내 것일 수 없는 인연의 운명이라나 생각하며 떠나리 12시간째 생각 없이 써내려간 너에게 보내는 편지 뭐라 답이 없을 것이지만 어쨌든 보겠지 너 떠나고 지금껏 한마디도 하지 않은 채 글만 써 내려가고 있어 이게 무슨 짓인지 나도 모른체 자유로운건 저 높은 하늘에 아름다운 새의 화려한 날개짓 아름다운건 그대가 좋아한 한아름 수놓은 꽃들의 향기 좋아했던건 그대와 사랑한 그 날을 회상했던 나의 시간 지금 슬픈건 이 세상 한 곳에 슬픈 인연으로 혼자된 그래 어차피 이것이 나의 슬픈 인연 이 운명 이 같은 운명 그래 나 현명한 선택을 내리리 나 그대 보내리 그리고 내 인연을 찾아 나 정처없이 떠나리 내 발목에 묶인 빨간 실끈 따라 나와 천생 연분인 그대 찾아나서 나 그대 만나리 그대 모습 상상하며 더 이상 되지도 않는 인연에 나 얽매이지 않으리 자유로운건 저 높은 하늘에 아름다운 새의 화려한 날개짓 아름다운건 그대가 좋아한 한아름 수놓은 꽃들의 향기 좋아 했던건 그대와 사랑한 그날을 회상했던 나의 시간 지금 슬픈건 이 세상 한곳에 슬픈 인연으로 혼자된
20000714,엑스라지,Sexy Lady,male,댄스,-,이상민,JUSTIN ,-,sexy lady 한번만 더 한번만 sexy lady beautiful woman 나의 이상형의 소유자 beautiful woman 사랑의 향기 앞에서 화려한 그대 앞에서 나는 어떡하나요 이 세상 그 무엇과도 비교할 수가 없어요 그대가 제일 예뻐요 sexy lady lovely lady beautiful lady you're always on my mind sexy woman lovely woman beautiful woman beautiful fine thing 언제나 아슬아슬한 그대는 beautiful fine thing 우리의 woman 흔들흔들 나의 맘을 앗아간 woman 흔하고 흔하지 않은 그대의 아름다움에 이미 난 빠져 있어요 말 한 번하고 싶은데 그대가 달아 날까봐 바라만 보고 있어요 sexy lady lovely lady beautiful lady you're always on my mind sexy woman lovely woman beautiful woman sexy lady 한 번만 두 번만 그렇게 바라만 보지 말고 Sangmind 그 특유의 몸짓은 그만 한번만 이렇게 서있는 버스앞에 그렇게 서있으면 어떡해 그렇게 애가 타는 everyday everyday 허구한 날 본 척도 안하고 서 있는 그대는 왜 차라리 가버려 girl 그게 훨 낫겠어 sexy lovely beautiful lady sexy lady lovely lady beautiful lady you're always on my mind sexy woman lovely woman beautiful woman sexy lady lovely lady beautiful lady you're always on my mind sexy woman lovely woman beautiful woman sexy lady lovely lady beautiful lady you're always on my mind sexy woman lovely woman
20000714,엑스라지,Deep Down,male,발라드,-,-,-,-,조그만 바램들을 잠이 든 그대에게 말해요 깊은 꿈에 빠진 나의 천사의 미소 깰까봐 나 조심히 얘기해요 아무 말 하지않고 나를 일으켜주는 그대 고마워요 깊게 그댈 더 사랑하고 바라며 서로 믿으며 살아가요 깊게 그댈 더 사랑하고 영원히 사랑하며 우리 행복해요 언젠가는 그대에게 갚아요 받기만 했던 사랑을 아름답게 바라봐요 우리들의 사랑을 그댄 꿈을 꾸고 있죠 들려요 높은 저 하늘에 펼쳐지는 우리의 사랑 얘기 깊게 그댈 더 사랑하고 바라며 서로 믿으며 살아가요 깊게 그댈 더 사랑하고 영원히 사랑하며 우리 행복해요 내 영혼이 저 하늘에 닿을때까지 그대만을 바라 볼께요 약속할게요 그대와 영원히 사랑해요 Deep down 그댈 더 사랑하고 바라며 서로 믿으며 살아가요 Deep down 그댈 더 사랑하고 영원히 사랑하며 우리 행복해요 Deep down I don't want you to go It hurts inside but I gotta hide the pain in my eyes Deep down I don't want you to go I have tried to find the reason why for you not to say good bye
20000714,엑스라지,Window Pain,male,발라드,-,-,-,-,차라리 몰랐으면 이 아픔 없을 텐데 왜 힘들게 넌 나에게 이 슬픈 선택을 영원 이상을 꿈꿔온 내게 뭐라고 말을 해 엎질러진 상처 영원히 가슴에 눈물 맺힐 친구를 버리는 내 자신에 용서 나의 사랑과 너와 호텔 그걸 본 나 여기 거리에 나 취해서 여기에서 비틀거리다 날 버린 너희 둘을 생각해 아깐 너무나 화나서 수첩에 더 이상 너희 둘의 흔적을 찢어 버리고 나와 걸었었어 나 잊었어 그렇게 해 너희 둘의사랑 축복해줄게 그녈 잘해줘 제발 울리지만마 탐이날 정도로 날 버릴 정도로 그녀가 그렇게 이뻤니 창가에 입김을 불어넣어 손을 걸어 약속했던 그 말이 생각이나 지금 쓰고있어 이미 지워졌지만 둘은 떠나갔지만 영원 이상을 꿈꿔온 내게 뭐라고 말을 해 엎질러진 상처 영원히 가슴에 눈물 맺힐 친구를 버리는 내 자신의 용서 공허함 속에 슬슬 잊혀지는 너의 모습 아련하기만 한대 허탈함 속에 찾아오는 너의 빈자리들을 메워줬던 그댄데 내 방황과 내 슬픔 모두 잡아줬던 그댄데 내 두 손 뻗어 그댈 잡을 수만 있다면 모든 것을 줄 텐데 이젠 너의 feeling 내 친구에게 뺏긴 그래도 I'm your man 둘이 잘 되길 나 바라보면서도 메마른 내 눈물 그래 그것이 너의 선택이었다면 나 이대로 그냥 창가에나 그냥 홀로 이 앉아 너의 모습 그리네 영원 이상을 꿈꿔온 내게 뭐라고 말을 해 엎 질러진 상처 영원히 가슴에 눈물 맺힐 친구를 버리는 내 자신에 용서 머리 속에 온통 네 이름 석자만 맴도는 내 모습에 나도 모르게 발걸음이 나를 옮겨 놓은 자리에 나도 모르게 나의 사랑과 네가 있는 곳으로 점점 빨려 들어가 어느새 셋이 함께 모여서 모르는 척 나는 모르는 척 그저 친구에게 나의 사랑을 맡긴 채 나는 멀리 떠나네 사랑하고 좋아하고 영원하고 싶기에 나는 무거운 발걸음을 옮기네 아직도 머리 속에 내가 너였다면 친구야 내가 너였다면 정말 이러지 않았을 텐데 잘살아라 자식아 열심히 영원 이상을 꿈꿔온 내게 뭐라고 말을 해 엎질러진 상처 영원히 가슴에 눈물 맺힐 친구를 버리는 내 자신에 용서
20000714,엑스라지,Rose,male,랩/힙합,-,-,-,-,이미 놀다 보니 날이 새 오늘 그녀를 만날 날이래 오늘은 그녀를 위한 준비 driving luxury car 섹시한 그녀는 나의 star 그녀의 남자인 이미 나도 star 이미 놀다 보니 날이 새 오늘 그녀를 만날 날이래 오늘은 그녀를 위한 준비 driving luxury car 섹시한 그녀는 나의 star 그녀의 남자인 이미 나도 star 좋은 차와 나의 미모가 어울리긴 하지 아름다운 내겐 장미와 느낌 없이 사는 건 싫어 너무 재미없어 나를 몰라주는 바보와 장미 예쁜 꽃 한 송이 감히 누가 쳐다봐 내 장미 가시없는 장미 흠 향기로운 내사랑 아 가까워지는구나 feel이와 그대가 느껴져 빨리가 그대를 안아주고 싶은 장미 입술 그 입술 키스 한번 하고픈 그대 입술 메마른 입술 촉촉히 감싸 압수 섹시한 그대 입술 압수 거기까지 더 이상은 안돼 나의 장미 좋은 차와 나의 미모가 어울리긴 하지 아름다운 내겐 장미와 느낌 없이 사는 건 싫어 너무 재미없어 나를 몰라주는 바보와 이미 놀다 보니 날이 새 오늘 그녀를 만날 날이래 오늘은 그녀를 위한 준비 driving luxury car 애교의 그녀는 나의 star 그녀의 남자인 이미 나도 star 이미 놀다 보니 날이 새 오늘 그녀를 만날 날이래 오늘은 그녀를 위한 준비 driving luxury car 애교의 그녀는 나의 star 그녀의 남자인 이미 나도 star 애교에게 그 이상의 표현 완벽한 미모 아 마음속 천사같은 착한 이의 곁에 두자 아무리 흠을 찾아도 어디 없네 장미 같은 입술 애교에 그대 여인의 향기 눈빛은 하여튼 나를 완전히 사로잡아 버리고 그 눈 밑에 보조개 그속에 빠져서 좋은 차와 나의 미모가 어울리긴 하지 아름다운 내겐 장미와 느낌 없이 사는 건 싫어 너무 재미없어 나를 몰라주는 바보와 좋은 차와 나의 미모가 어울리긴 하지 아름다운 내겐 장미와 느낌 없이 사는 건 싫어 너무 재미없어 나를 몰라주는 바보와 언제 2001년 지금 넘어 그대 사랑하고있어 음 행복해 그대와 결혼하고 싶어 나를 받아줘 영원히 사랑 하겠어 그대만을 장미 사랑하는 나의 장미 입술에 흐르는 촉촉한 느낌에 눈빛 날 사로잡은 눈 밑에 보조개 그대 덮은 향기 사랑하는 나의 여인의 향기 사랑의 향기 좋은 차와 나의 미모가 어울리긴 하지 아름다운 내겐 장미와 느낌 없이 사는 건 싫어 너무 재미없어 나를 몰라주는 바보와 좋은 차와 나의 미모가 어울리긴 하지 아름다운 내겐 장미와 느낌 없이 사는 건 싫어 너무 재미없어 나를 몰라주는 바보와
