년도,가수,제목,남녀,장르,최고순위,작사가,작곡가,소속사,가사
20000714,엑스라지,미안해,male,발라드,-,이상민,김성태,-,흐르는 눈물 흐르게 놔두고 너를 슬프게 한 것 딱한 널 버린 것 그저 멍하게 아무 말 안하고 혼자가 될 너를 그렇게 버리고 이미 원했던대로 됐는데 시무룩하지마 그녈 넌 잊어야 해 미안해 사랑해 내가 돌아와 그렇게도 널 사랑했었나 봐 미안해 사랑해 다시 돌아와 내 곁으로 소용없는 것 아무리 찾아도 너의 어떤 흔적도 어디에 없는 것 아니었다고 지우지 말라고 나의 기억을 네게 돌아갈테니 아 내가 네게 했었던 그 못된 짓들 어떻게 해야 기억에서 지워져 미안해 사랑해 내가 돌아와 그렇게도 널 사랑했었나 봐 미안해 사랑해 다시 돌아와 내 곁으로 돌아와 나에게 옛날로 돌아가 행복하게 행복하게 다시는 다시는 널 내게서 내게 있어 넌 하나뿐인걸 없어선 안될 나의 소중한 너 I'm so glad I'm so glad I'm so glad 널 사랑했었나 봐 I'm so glad I'm so glad That we were friends before lovers I'm so glad I'm so glad No matter what you do I'm so glad we were friends before lovers 널 사랑해 널 사랑해 널 사랑해 I'm so glad 미안해 널 사랑했었나봐 I'm so glad That we were friends before lovers
20000714,엑스라지,Why,male,랩/힙합,-,-,-,-,"why do you wanna take mine 나 이제 알았어 그 모든 것  그 모든 것이 부질없었다는 것 나 여태껏 이뤘던 꿈과 내 삶과 명예가 한 순간에 짓밟히는 것을 느낀 이 때가 내 주위 친구들에게 외쳤었던 help 그마저 외면하고 등을 돌린 니네가 나 이제 보니 내 곁에서 머물렀었던건 내 환심만 얻으려는 내 약점만 뺏으려는 내 돈이 돈이 그렇게도 탐났나 아님 그 무엇이 무엇이 니넬 변하게 했나 날 무시무시하고 나의 뒤통수를 치나 나 성공하는게 그렇게도 싫으나 못마땅하나 다 필요 없어 나 일어섰어  나 혼자 힘으로 모든 것을 이룩했어 나 결정했어 Just simple and plain  결국엔 믿을 수 있는건 오직 내 자신인걸 Man I don't understand 니네가 하는 짓 What's mine is mine 내줄 수 없는 것 Uh~ why do you wanna take mine 수많은 별들 속에  내 초라한 모습 거기 어디 있나 있다면, 왜 내 자신 만 그렇게 빛나질 못하나  내게 희망을 걸었던 모든 이들  얼마나 아파할까나 실패할까 두려워지네 most likely 나 정말 해낼 수 있었어 좋은차 굴리면서 나도 남 부럽지 않게 돈도 쓰며 마음은 벌써 저 상류 사회에 있는데 왜 내 자신이 느끼는건 pain, 절망뿐 forever 널 용서하지 않아 나 이리 된 건 너의 배신과 사기 널 믿었던 내가 잘못이지 어찌 한 사람의 인생을 갖고 이리 할 수 있나 믿을 수 없어 손만 뻗으면  닿을 것 같은 저 사회가 날 부르는데 지금 내 눈 앞에 있는건  회색 벽돌들과 조그마한 창문 내 돈과 여자와 모든 것을 빼앗고  난 너에게 사기 당했고 넌 밖이고 난 안이고 너의 지금 위치가 나였고 배신과 사기 속에 내 인생 무참히 망가졌네 이런 사회는 It don' belong to you 아가씨 하이힐 그 끝으로 오르는  치마 차마 말로는 못할  아무도 모르는 나만의 상상 different 세상의 아이 쎄쎄쎄 the other  세상의 멜로디의 노래를 부르짖어 저기 아이와 나 천사와 나 무언가  다르게 내 마음의 나 싸우는 나 어떻하겠어 그 뒤에 니가 나를 바라보듯이  내게도 내 삶의 내 맘의 자유라 하며 살아가겠어 그러다 내가 밥이건 니가 적이던  내일도 없이 살아가게 될 건 너와 나 같아 really simple 하게만 살아가는 이 사람 저 사람  그 속에 반반 빈익빈 부익부 못 오를 저 나무 다 잘라버려  그 무엇이 무엇이 더 필요하겠어 why do you wanna take mine once I step on a room  you feel the tycoon in your present boy you about to feel yo doom on my dead  presidents since out the room I`m known to act silly  can`t tell put my butt in 6 deep put my name on a tomb  I bet you feel me no really hear me listen niggaz like dizzy dog  you got me pissed like toilet boil but I feel the breast of  it all it took me a long time to get mine and can't take it got me  crossed up with the wrong ones in another word you got me  mistaken cause you can't see me like Incoknito is he  who is he YB legendary boy like the Beatles for my people my campo  my comrads you must have came a long way to get paid in a rough day  got me in a way gotta get my cash fast that be my attitude  but understand what I got  it don't belong to you~~ why do you wanna take mine stepped out my house on a way to  get some gas with my prefel vision I saw skim ass  they was gonna lay me down is this the end of chuck? I looked up to the sky  and said god please interrupt what did I ever did to  deserve this but at that time I felt a pistol across my head  and it took the curve quick almost vaconcious bleeding  from the head I keep hearing voice saying give it up fool or you're dead  what made them think that I was doing big things  I've been working my butt off doing chuck chain long live the game  by still living in a hood even if you became a victim of  these fools up no good gun start to click clack my heart start to  beat fast I could hear the glass shatter from bullets  flying pass and I know what goes around comes around  it was the jack who jacked the jack who was laying me down  I don't understand the things that you do but what's mine is  mine it don't belong to you why do you wanna take mine"
20000714,엑스라지,슬픈 약속,male,발라드,-,-,-,-,이 정도 힘든 거라면 참을 수 있어 니가 원한거라하면 가슴에 슬픈 눈물을 난 묻어 둔 채 웃으며 보낼게 헤어져야만 한다는건 내 영혼을 잃는 것 같아 제발 이런 나의 맘을 아는지 넌 정말 날 사랑했었니 믿을 수가 없어 다음엔 다시 슬픈 약속은 하지마 마지막이란 슬픈 얘기 잊겠다는 힘든 약속 지키려고 나 돌아서며 너를 보낼게 하루하루 그렇게 너를 생각하기까지 나에게로 한 번도 소식없는 너의 그런 모습으로 보고파 혹시나 싶어 감춰뒀던 네 사진들을 보면서 흘리는 내 모습으로 사랑했었구나 떠나며 뒤 한번 안 돌아본 사람 생각해 무얼해 기다려 무얼해 하지만 나 없는 빈자리 네게는 불행만이 오겠지 하지만 다음에 다음에 너 하나 없을 때 그땐 아파도 한번 더 널 사랑하도록 할게 스쳐간 옛 생각들 슬픔보다 많은 즐거움들 다시는 없을 생각에 눈물을 난 멈출수가 없어 오 lady 영원할 것만 같던 우리 한 순간에 무너졌지 lady 잊으려 하면 할수록 더 떠올라 너의 얼굴이 아픔이 밀려와 다음엔 다시 슬픈 약속은 하지마 마지막이란 슬픈 얘기 잊겠다는 힘든 약속 지키려고 나 돌아서며 너를 보낼게 다음엔 다시 슬픈 약속은 하지마 마지막이란 슬픈 얘기 잊겠다는 힘든 약속 지키려고
20000714,엑스라지,인연,male,댄스,-,이상민,JUSTIN ,-,사랑하는 사람아 그대가 떠날 때 내 슬픔의 전부를 가져가길 바라며 사랑하는 그대가 내 것일 수 없는 인연의 운명이라나 생각하며 떠나리 사랑하는 사람아 그대가 떠날 때 내 슬픔의 전부를 가져가길 바라며 사랑하는 그대가 내 것일 수 없는 인연의 운명이라나 생각하며 떠나리 멈칫멈칫 가끔 뒤를 돌아보게 돼 인연이라면 다시 찾아오겠지 나를 부르겠지 자유롭게 너도 꼭 한번 살고 싶었겠지 오겠지 날 찾겠지 이대로 영영 못 보면 어떡하지 I hope I see you I just don't wanna reminisce 자유로운건 저 높은 하늘에 아름다운 새의 화려한 날개짓 아름다운건 그대가 좋아한 한아름 수놓은 꽃들의 향기 좋아했던건 그대와 사랑한 그 날을 회상했던 나의 시간 지금 슬픈건 이 세상 한 곳에 슬픈 인연으로 혼자된 사랑하는 사람아 그대가 떠날 때 내 슬픔의 전부를 가져가길 바라며 사랑하는 그대가 내 것일 수 없는 인연의 운명이라나 생각하며 떠나리 12시간째 생각 없이 써내려간 너에게 보내는 편지 뭐라 답이 없을 것이지만 어쨌든 보겠지 너 떠나고 지금껏 한마디도 하지 않은 채 글만 써 내려가고 있어 이게 무슨 짓인지 나도 모른체 자유로운건 저 높은 하늘에 아름다운 새의 화려한 날개짓 아름다운건 그대가 좋아한 한아름 수놓은 꽃들의 향기 좋아했던건 그대와 사랑한 그 날을 회상했던 나의 시간 지금 슬픈건 이 세상 한 곳에 슬픈 인연으로 혼자된 그래 어차피 이것이 나의 슬픈 인연 이 운명 이 같은 운명 그래 나 현명한 선택을 내리리 나 그대 보내리 그리고 내 인연을 찾아 나 정처없이 떠나리 내 발목에 묶인 빨간 실끈 따라 나와 천생 연분인 그대 찾아나서 나 그대 만나리 그대 모습 상상하며 더 이상 되지도 않는 인연에 나 얽매이지 않으리 자유로운건 저 높은 하늘에 아름다운 새의 화려한 날개짓 아름다운건 그대가 좋아한 한아름 수놓은 꽃들의 향기 좋아 했던건 그대와 사랑한 그날을 회상했던 나의 시간 지금 슬픈건 이 세상 한곳에 슬픈 인연으로 혼자된
20000714,엑스라지,Sexy Lady,male,댄스,-,이상민,JUSTIN ,-,sexy lady 한번만 더 한번만 sexy lady beautiful woman 나의 이상형의 소유자 beautiful woman 사랑의 향기 앞에서 화려한 그대 앞에서 나는 어떡하나요 이 세상 그 무엇과도 비교할 수가 없어요 그대가 제일 예뻐요 sexy lady lovely lady beautiful lady you're always on my mind sexy woman lovely woman beautiful woman beautiful fine thing 언제나 아슬아슬한 그대는 beautiful fine thing 우리의 woman 흔들흔들 나의 맘을 앗아간 woman 흔하고 흔하지 않은 그대의 아름다움에 이미 난 빠져 있어요 말 한 번하고 싶은데 그대가 달아 날까봐 바라만 보고 있어요 sexy lady lovely lady beautiful lady you're always on my mind sexy woman lovely woman beautiful woman sexy lady 한 번만 두 번만 그렇게 바라만 보지 말고 Sangmind 그 특유의 몸짓은 그만 한번만 이렇게 서있는 버스앞에 그렇게 서있으면 어떡해 그렇게 애가 타는 everyday everyday 허구한 날 본 척도 안하고 서 있는 그대는 왜 차라리 가버려 girl 그게 훨 낫겠어 sexy lovely beautiful lady sexy lady lovely lady beautiful lady you're always on my mind sexy woman lovely woman beautiful woman sexy lady lovely lady beautiful lady you're always on my mind sexy woman lovely woman beautiful woman sexy lady lovely lady beautiful lady you're always on my mind sexy woman lovely woman
20000714,엑스라지,Deep Down,male,발라드,-,-,-,-,조그만 바램들을 잠이 든 그대에게 말해요 깊은 꿈에 빠진 나의 천사의 미소 깰까봐 나 조심히 얘기해요 아무 말 하지않고 나를 일으켜주는 그대 고마워요 깊게 그댈 더 사랑하고 바라며 서로 믿으며 살아가요 깊게 그댈 더 사랑하고 영원히 사랑하며 우리 행복해요 언젠가는 그대에게 갚아요 받기만 했던 사랑을 아름답게 바라봐요 우리들의 사랑을 그댄 꿈을 꾸고 있죠 들려요 높은 저 하늘에 펼쳐지는 우리의 사랑 얘기 깊게 그댈 더 사랑하고 바라며 서로 믿으며 살아가요 깊게 그댈 더 사랑하고 영원히 사랑하며 우리 행복해요 내 영혼이 저 하늘에 닿을때까지 그대만을 바라 볼께요 약속할게요 그대와 영원히 사랑해요 Deep down 그댈 더 사랑하고 바라며 서로 믿으며 살아가요 Deep down 그댈 더 사랑하고 영원히 사랑하며 우리 행복해요 Deep down I don't want you to go It hurts inside but I gotta hide the pain in my eyes Deep down I don't want you to go I have tried to find the reason why for you not to say good bye
20000714,엑스라지,Window Pain,male,발라드,-,-,-,-,차라리 몰랐으면 이 아픔 없을 텐데 왜 힘들게 넌 나에게 이 슬픈 선택을 영원 이상을 꿈꿔온 내게 뭐라고 말을 해 엎질러진 상처 영원히 가슴에 눈물 맺힐 친구를 버리는 내 자신에 용서 나의 사랑과 너와 호텔 그걸 본 나 여기 거리에 나 취해서 여기에서 비틀거리다 날 버린 너희 둘을 생각해 아깐 너무나 화나서 수첩에 더 이상 너희 둘의 흔적을 찢어 버리고 나와 걸었었어 나 잊었어 그렇게 해 너희 둘의사랑 축복해줄게 그녈 잘해줘 제발 울리지만마 탐이날 정도로 날 버릴 정도로 그녀가 그렇게 이뻤니 창가에 입김을 불어넣어 손을 걸어 약속했던 그 말이 생각이나 지금 쓰고있어 이미 지워졌지만 둘은 떠나갔지만 영원 이상을 꿈꿔온 내게 뭐라고 말을 해 엎질러진 상처 영원히 가슴에 눈물 맺힐 친구를 버리는 내 자신의 용서 공허함 속에 슬슬 잊혀지는 너의 모습 아련하기만 한대 허탈함 속에 찾아오는 너의 빈자리들을 메워줬던 그댄데 내 방황과 내 슬픔 모두 잡아줬던 그댄데 내 두 손 뻗어 그댈 잡을 수만 있다면 모든 것을 줄 텐데 이젠 너의 feeling 내 친구에게 뺏긴 그래도 I'm your man 둘이 잘 되길 나 바라보면서도 메마른 내 눈물 그래 그것이 너의 선택이었다면 나 이대로 그냥 창가에나 그냥 홀로 이 앉아 너의 모습 그리네 영원 이상을 꿈꿔온 내게 뭐라고 말을 해 엎 질러진 상처 영원히 가슴에 눈물 맺힐 친구를 버리는 내 자신에 용서 머리 속에 온통 네 이름 석자만 맴도는 내 모습에 나도 모르게 발걸음이 나를 옮겨 놓은 자리에 나도 모르게 나의 사랑과 네가 있는 곳으로 점점 빨려 들어가 어느새 셋이 함께 모여서 모르는 척 나는 모르는 척 그저 친구에게 나의 사랑을 맡긴 채 나는 멀리 떠나네 사랑하고 좋아하고 영원하고 싶기에 나는 무거운 발걸음을 옮기네 아직도 머리 속에 내가 너였다면 친구야 내가 너였다면 정말 이러지 않았을 텐데 잘살아라 자식아 열심히 영원 이상을 꿈꿔온 내게 뭐라고 말을 해 엎질러진 상처 영원히 가슴에 눈물 맺힐 친구를 버리는 내 자신에 용서
20000714,엑스라지,Rose,male,랩/힙합,-,-,-,-,이미 놀다 보니 날이 새 오늘 그녀를 만날 날이래 오늘은 그녀를 위한 준비 driving luxury car 섹시한 그녀는 나의 star 그녀의 남자인 이미 나도 star 이미 놀다 보니 날이 새 오늘 그녀를 만날 날이래 오늘은 그녀를 위한 준비 driving luxury car 섹시한 그녀는 나의 star 그녀의 남자인 이미 나도 star 좋은 차와 나의 미모가 어울리긴 하지 아름다운 내겐 장미와 느낌 없이 사는 건 싫어 너무 재미없어 나를 몰라주는 바보와 장미 예쁜 꽃 한 송이 감히 누가 쳐다봐 내 장미 가시없는 장미 흠 향기로운 내사랑 아 가까워지는구나 feel이와 그대가 느껴져 빨리가 그대를 안아주고 싶은 장미 입술 그 입술 키스 한번 하고픈 그대 입술 메마른 입술 촉촉히 감싸 압수 섹시한 그대 입술 압수 거기까지 더 이상은 안돼 나의 장미 좋은 차와 나의 미모가 어울리긴 하지 아름다운 내겐 장미와 느낌 없이 사는 건 싫어 너무 재미없어 나를 몰라주는 바보와 이미 놀다 보니 날이 새 오늘 그녀를 만날 날이래 오늘은 그녀를 위한 준비 driving luxury car 애교의 그녀는 나의 star 그녀의 남자인 이미 나도 star 이미 놀다 보니 날이 새 오늘 그녀를 만날 날이래 오늘은 그녀를 위한 준비 driving luxury car 애교의 그녀는 나의 star 그녀의 남자인 이미 나도 star 애교에게 그 이상의 표현 완벽한 미모 아 마음속 천사같은 착한 이의 곁에 두자 아무리 흠을 찾아도 어디 없네 장미 같은 입술 애교에 그대 여인의 향기 눈빛은 하여튼 나를 완전히 사로잡아 버리고 그 눈 밑에 보조개 그속에 빠져서 좋은 차와 나의 미모가 어울리긴 하지 아름다운 내겐 장미와 느낌 없이 사는 건 싫어 너무 재미없어 나를 몰라주는 바보와 좋은 차와 나의 미모가 어울리긴 하지 아름다운 내겐 장미와 느낌 없이 사는 건 싫어 너무 재미없어 나를 몰라주는 바보와 언제 2001년 지금 넘어 그대 사랑하고있어 음 행복해 그대와 결혼하고 싶어 나를 받아줘 영원히 사랑 하겠어 그대만을 장미 사랑하는 나의 장미 입술에 흐르는 촉촉한 느낌에 눈빛 날 사로잡은 눈 밑에 보조개 그대 덮은 향기 사랑하는 나의 여인의 향기 사랑의 향기 좋은 차와 나의 미모가 어울리긴 하지 아름다운 내겐 장미와 느낌 없이 사는 건 싫어 너무 재미없어 나를 몰라주는 바보와 좋은 차와 나의 미모가 어울리긴 하지 아름다운 내겐 장미와 느낌 없이 사는 건 싫어 너무 재미없어 나를 몰라주는 바보와
20021207,엑스라지,사랑은 없다,male,발라드,-,-,-,-,그녀를 사랑하고 너무 힘든 나 그녀를 아름답게 보내줘야해 그녀야 나보다도 나은 사람과 행복하게 잘살아가야해 너를 보내는게 너무 슬프구나 남잔 나의 사랑 방식이지 그래도 니가 처량하구나 부디 좋은 사람 만나기를 너와 처음 만나 행복했을때 너를 안아 주며 사랑했을때 너와 영원 하길 기도했을때 그때 그 기억에 눈물이 아마 너도 지금 울고 있겠지 나보다도 심한 슬픔 속에서 그렇지만 일년이 지나고 나면 다시 편해지고 좋아질걸 벌써 몇년이 흘러갔겠구나 어디서 어디에 있는지 가끔은 내 생각을 하는지 바보같은 생각으로 살아 너와 처음 만나 행복했을때 너를 안아 주며 사랑했을때 너와 영원 하길 기도했을때 그때 그 기억에 눈물이 아마 너도 지금 울고 있겠지 나보다도 심한 슬픔 속에서 그렇지만 일년이 지나고 나면 다시 편해지고 좋아지걸 그래 더 이상 너를 찾는건 추억을 슬프게만 해 이제 이렇게 되길 바라며 그리며 잊어버릴께 아마 너도 지금 울고 있겠지 나보다도 심한 슬픔 속에서 그렇지만 일년이 지나고 나면 다시 편해지고 좋아질걸
20021207,엑스라지,행복해라,male,댄스,-,-,-,-,그 여자에겐 좋은일들만 행복하게만 아름답게만 내사랑에게 다가올 이별만큼은 그늘이 없는 저 태양처럼 오늘도 너의 생각에 슬퍼서 너의 기억으로 울지만 이내 또 사라지면 가슴 아픈사랑 그게 나인걸 그렇게 너의 그 모습 수줍던 눈빛 촉촉한 입술 그느낌 이제는 내가 더 이상 바래서는 안돼는 꿈인걸 알지만 언젠가 함께 갔었던 바다와 너와 지어가던 대지와 처음 너와의 입맞춤 모두 어제 얘기같은걸 이젠 딴사람 품에 안길 니가 나의 눈물되어 흘러도 그때 날 비켜 가서 행복한 거라면 그걸로 됐어 정말 그럴껄 우리의 슬픔을 그이별 시간잊을려나 그대자꾸파 내맘아파 눈에맺힌 눈물이 나와 하루 일년 내평생 그대 그리며 살아 그녀는 나의 첫사랑 첫이별 사랑한것만큼 슬퍼도 너에 발끝을 보면서 널 힘없이 떠나 보냈지 이젠 딴사람 품에 안길 니가 나의 눈물되어 흘러도 그때 날 비켜가서 행복한 거라면 그걸로 됐어 나 이렇게 살지만 너의 기억에 울지만 넌 어디를 가든지 너만은 행복해 오늘도 담배연기에 그려진 너의 기억으로 울지만 이내 또 사라진건 가슴 아픈사랑 그게 나인걸 내일도 너의 생각에 슬퍼서 너의 기억으로 울지만 이내 또 사라진건 가슴아픈 사랑 그게 나인걸 그 여자에겐 좋은일들만 행복하게만 아름답게만 내사랑에게 다가올 이별만큼은 그늘이 없는 저 태양처럼
20021207,엑스라지,피도 눈물도 없이,male,댄스,-,-,-,-,널 사랑했단 이유로 이제 내가슴이 찢어져 나 어떡해야 좋을 지 몰라 지금까진 분명 좋았지 갑작스런 너의 변심 앞에서 난 피눈물을 흘리며 다 잊으리라 다짐하지만 차라리 솔직하게 말해줘 너를 원망하지않게 이렇게 날 차버린 널 깨끗이 잊어버리게 이제와 잡아도 소용없어 피도 눈물도 없이 떠나버린 너 나를 잡지 않아 처량한 비라도 내린다면 내가 이땅에 태어나 가장 슬픈 날은 오늘이 될거야 사나이란 이름 하나로 너 하나를 위해 살아온 시간 더 잘해줄걸 후회만 내 가슴 속에 남아있지만 무너진 자존심에 내 모습 너무 비참하지 않게 눈물쯤은 흘려주길 기대한 내가 바보야 이제와 잡아도 소용없어 피도 눈물도 없이 떠나버린 너 나를 잡지 않아 처량한 비라도 내린다면 내가 이 땅에 태어나 가장 슬픈 날은 오늘이 될거야 달려가 다시 널 안고 싶어 아무 느낌도 없이 돌아서는 너 나를 보지않아 그래봐 너도 좀 아플거야 혹시 그리워 내 모습 보고 싶어지면 내게로 돌아와 돌아와 돌아와
20021207,엑스라지,So Long,male,댄스,-,-,-,-,나나나 널 떠나 보낸 후에 나 후회하며 얽매이며 한 맺혀 외쳐봐 나 눈물에 목이 메어와 기나긴 그림움에 내 영혼마저 사라져도 그대 이름 불러봐도 지금 내 삶 끝난데도 Now now check it Don't break it Our relationship is over now But I want you back now I need you back I miss you much Yo I'm in da clutch I want you touch but I can't do much So Long 무슨 일이야 너 내 앞에 슬픈 얼굴로 찾아와 우는건 행복할 거라 나를 떠난 네가 이런 모습으로 나타나 지금이라도 너 내 곁에와 머물러줘 지금 모습 그대로 맡겨줘 눈물과 아픔 어떻게든 할테니까 나에게 지금보다 행복한 훨씬 너다운 모습을 눈물이 없는 예전의 그 기억을 난 찾게 할거야 사랑해 내가 곁에 있어 언제나 그사람 잊어 모든 것을 버려 울고 싶을 때는 울어 내 어깨에 기대고 가슴에 안겨서 나의 바람은 언제나 네가 처음처럼 웃을 수 있는 그런 여자로 돌아오기를 So long 지금 only 잠시 떠나있을뿐 This song 너를 위해 기억속에 남겨 줄뿐 So soon pretty soon 우리 다시 만날뿐 이 바쁜 나날들이 지날뿐 내모습 잠시 사라지더라도 나 떠나가도 내 환영도 기억해봐도 Mo doe that I flow mad flow You'll know what you know 나 다시 돌아오니까 어려서부터 내가 정에 약해 살아왔어 너를 너무 사랑해서 네가 상처주기 싫어서 보냈었지만 내게 돌아온 너는 정신없이 울어댔어 싫어 그에게 멀리 떨어져 내게 돌아와줘 지금보다 행복한 훨씬 너다운 모습을 눈물이 없는 예전의 그 기억을 난 찾게 할거야 사랑해 내가 곁에 있어 언제나 그사람 잊어 모든 것을 버려 울고 싶을 때는 울어 내 어깨에 기대고 가슴에 안겨서 나의 바램은 언제나 네가 처음처럼 웃을 수 있는 그런 여자로 돌아오기를 맡겨줘 눈물과 아픔 내가 어떻게든 할테니까 가슴에 나에겐 네가 전부라는걸 알아줘 제발 사랑해 내가 곁에 있어 언제나 이대로 너와 영원할꺼 니까 울고 싶을 때는 울어 내 어깨에 기대고 가슴에 안겨서 나를 만나서 달라진 너를 보고싶어 지금보다 훨씬 더 나은 너의 모습을 영원히 너만을 내가 사랑하겠어
20021207,엑스라지,어차피,male,댄스,-,-,-,-,"날 사랑한거야 너 그럴거야 너 널 위한 준비 우린 사랑했지 그렇다고 말해줘 어차피 떠날 너인데 사랑했을 때 만큼 우린 좋았어 lonely lonely 처음 만날 때 only only 서로 사랑해 lonely only lonely 영원하기를 우니 우니 뭐가 슬프니 우리 이제 헤어지니 왜 함께 할 때 이리 좋은데 가니 날 사랑한거야 너 그럴거야 너 널 위한 준비 우린 사랑했지 그렇다고 말해줘 어차피 떠날 너인데 사랑했을 때 만큼 우린 좋았어 Cause I feel lonely lonely 우리 가슴에 기억으로 남아주길 우리 사랑했던 추억 아름다웠어 I was maxin, relaxin watching TV Thinking about that time when you said you wanted to leave me Now I'm ready My nerves are steady Before you leave baby talk to me please Since we're through answer one thing Was our love truht or just a little fling Now keep this in mind before the singer sings You're my queen and I'll always be your king 날 사랑한거야 너 그럴거야 너 널 위한 준비 우린 사랑했지 그렇다고 말해줘 어차피 떠날 너인데 사랑했을 때 만큼 우린 좋았어 널 사랑한거야 널 사랑했어 널 바보처럼 그저 사랑햇어 사랑했다 말해줘 어차피 떠날 너인데 사랑했을 때 만큼 우린 좋았어"
20021207,엑스라지,해&해,male,댄스,-,-,-,-,-
