년도,가수,제목,남녀,장르,최고순위,작사가,작곡가,소속사,가사
20101115,트랙스,Tell Me Your Love,male,국내드라마,-,기승주,조용훈,(주)SM엔터테인먼트,눈부시던 그때 tell me your love 그대가 없는 나는 혼자인 걸 fall in your love 멀어진 기억속에 흩어진 널 I love u love u love u 내 손을 놓지는마 Oh I love u love u Always tell me your love 눈 감으면 그때의 바람 그때 향기가 날 감싸안아 떨리던 순간 꿈처럼 아련한 기억속으로 이끌려 아나요 꿈만 같은걸 너와 함께한 그 시간에 공기까지도 달콤하다는걸 눈부시던 그때 tell me your love 그대가 없는 나는 혼자인 걸 fall in your love 멀어진 기억속에 흩어진 널 I love u love u love u 내 손을 놓지는마 Oh I love u love u Always tell me your love 언젠가는 지금의 우릴 잊고 살아갈 수도 있겠지 하지만 지난 시간의 무게보다 너를 사랑할꺼야 내 눈에 니가 번져서 어떤 것도 볼 수 없음을 오직 너만이 내 맘속에 있어 눈부시던 그때 tell me your love 그대가 없는 나는 혼자인 걸 fall in your love 멀어진 기억속에 흩어진 널 I love u love u love u 내 손을 놓지는마 Oh I love u love u Always tell me your love 그대도 이런 맘이겠죠 들려요 하루종일 그대음성 나른한 향기같은 시간은 나와 같겠죠 눈부시던 그때 tell me your love 그대가 없는 나는 무의미한걸 fall in your love 담겨진 추억속에 유일한 널 I love u love u love u 내 손을 놓지는마 Oh I love u love u Always tell me your love oh I love u love u always tell me your love
20100906,트랙스,오! 나의 여신님 (Oh! My Goddess),male,록/메탈,-,제이 (Jay Hong),Jaakko Manninen,(주)SM엔터테인먼트,so ONE 하던 TWO my girl THREE 눈이 부신 로렐라이 oh hey lady FOUR my love FIVE 5분만 만나줄래 지겨웠던 이별 상처 눈물 모두 Stop 너 원한다면 어디든지 I will go Uh 널 바래 널 원해 나 Wanna Wanna 원해 널 눈이 눈이 너만 바라보게 하는 Girl 내 맘이 맘이 너를 가득 채워버린 걸 받아줘 내 맘 애타게 널 Waiting Baby 눈이 눈이 너만 바라보고 있는 Boy 내 맘이 맘이 그녀 마음 뺏어버린 Boy Oh 제발 난 더 지치는 건 No More Baby 오 나의 여신 I keep waiting I keep calling 왜 말이 말이 없는 걸까 모든 걸 다 준대도 부족한 Girl 기다리던 너의 전화 대답 모두 Stop 날 두근두근 애태우던 심장마저 Stop 시계도 시간도 널 조마조마 기다려 내 눈이 눈이 너만 바라보게 하는 Girl 내 맘이 맘이 너를 가득 채워버린 걸 받아줘 내 맘 애타게 널 Waiting Baby 눈이 눈이 너만 바라보고 있는 Boy 내 맘이 맘이 그녀 마음 뺏어버린 Boy Oh 제발 난 더 지치는 건 No More Baby 오 나의 여신 워우워우워 와 내게로 워우워우워 Oh Baby Girl Baby Baby 내 맘 모두 알아버린 Girl I love you love you 내 맘 모두 가져버린 걸 내 품에 널 꼭 영원히 안을게 Oh Baby Baby 세상모두 가진 너의 Boy 나 너를 너를 영원토록 지켜주는 Boy Only One 너만 바라볼게 Love You Venus 오 나의 여신
20100906,트랙스,Let`s Play,male,록/메탈,-,임서현,정모 (JUNGMO),(주)SM엔터테인먼트,또 누구였는지 전활 왜 꺼둔 건지 묻는 것도 지겨워 손가락 다 세도 모자란 남자들 그 중에 난 사양할게 You are so crazy You make me crazy 아직도 넌 나를 몰라 너의 그 손길과 입술에 나 역시 흥미 잃은 지 오랜 걸 Bye Bye 이제 모두 다 가져가 너에게 취해서 비틀댄 시간들까지도 Bye 남은 사랑 따윈 없어 우연도 피해 줘 꿈에도 보이지마 Get away 저 문을 열고서 들어 올 순간부터 늘어 놓을 거짓말 그들에게 줬던 그 눈빛으로 날 보는 것도 소름 돋아 You are so crazy You make me crazy 네 멋대로 하고 살아 달콤한 숨결로 손짓 해 네 앞에 무릎 꿇린 남자들과 Bye Bye 이제 모두 다 가져가 너에게 취해서 비틀댄 시간들까지도 Bye 남은 사랑 따윈 없어 우연도 피해 줘 꿈에도 보이지마 Get away 그래도 한 순간 사랑한 너라서 어떻게든 기다릴까도 했지만 못 고쳐 안 고쳐 난 지쳐 he end I wanna go away Bye Bye 이제 모두 다 가져가 너에게 취해서 비틀댄 시간들까지도 Bye 남은 사랑 따윈 없어 우연도 피해 줘 꿈에도 보이지마 Get away Bye Bye 이제 모두 다 끝났어 나 같은 남자를 놓치고 눈물이 나도록 넌 후회하게 될테니까 이제 난 너 없는 자유를 누릴게 Let's play
20100906,트랙스,자기야 (Jagiyah),male,록/메탈,-,조윤경,MARK STEIN,(주)SM엔터테인먼트,마지막 널 만나는 기회 웃으며 넌 내게 말하네 Good Bye 멀어져가 Some Memories 함께 원하던 The Memories 사랑에 빠졌던 그 때 모두 꿈처럼 너무 멀게만 와버린 걸까 너무 빠르게 다 간 걸까 이제 다신 다신 못 부를 자기야 자기야 마지막 널 만나는 곳에 전화 걸어 너를 부르네 내게 돌아와줘 너무 아름다운 널 멈추게 하고 싶어 아직 나의 남은 사랑 Without You 너무 멀게만 와버린 걸까 너무 빠르게 다 간 걸까 이제 다신 다신 못 부를 자기야 자기야 네 안에 날 잊지마 Oh No Oh No Oh No No 먼 날에도 기억해 나를 잊지 마 너무 멀게만 와버린 걸까 너무 빠르게 다 간 걸까 이제 다신 다신 못 부를 자기야 자기야
20100906,트랙스,Rush,male,록/메탈,-,Jos Jorgensen,Jos Jorgensen,(주)SM엔터테인먼트,Du Ru Ru Ru Ru Du Ru Ru Ru Ru Du Ru Ru Ru Du Ru Ru Du Ru Ru Ru At Night 널 바래다 주던 길을 이제는 널 잊으려고 달려 가 비운다 내 옆 빈 자리처럼 내 안의 네 자리도 머리카락 사이마다 찬 바람이 스쳐갈 때 머릿속 너의 기억도 날려 버린다 I never be with you 너를 보낸다 이 길이 끝날 때쯤 너는 없어 아쉬울 것도 미련도 없다 볼륨을 높이고 이 어둠을 Rush Du Ru Ru Ru Ru Du Ru Ru Ru Ru Du Ru Ru Ru Du Ru Ru Du Ru Ru Ru At Night 저 시린 달빛이 울고 화려한 불빛마저 글썽이면 잊는다 움켜 쥐어도 새는 모래알 같은 사랑 Baby 차 창 너머 손 내밀면 찬 어둠이 내려 앉아 어둠에 너의 기억을 묻어 버린다 I never be with you 너를 보낸다 이 길이 끝날 때쯤 너는 없어 아쉬울 것도 미련도 없다 볼륨을 높이고 이 어둠을 Rush Oh 네가 쉬웠다면 나 역시 그래 고작 이별쯤에 아프지 않아 세상이 잠 깨기 전에 널 잊는다 I never be with you 너를 보낸다 이 길이 끝날 때쯤 너는 없어 아쉬울 것도 미련도 없다 볼륨을 높이고 이 어둠을 Rush Du Ru Ru Ru Ru Du Ru Ru Ru Ru Du Ru Ru Ru Du Ru Ru Du Ru Ru Ru Du Ru Ru Ru Ru Du Ru Ru Ru Ru Du Ru Ru Ru Du Ru Ru Du Ru Ru Ru
20100906,트랙스,없는 사람 (Everlasting Story),male,"발라드, 록/메탈",-,윤사라,정모 (JUNGMO),(주)SM엔터테인먼트,다들 위로하지 시간이 고쳐준다고 잊지 않으려고 해도 결국엔 다 잊혀진다고 얼마나 좋았는데 그대 날 어떻게 보내 지우고 싶은 것은 이별한 순간뿐인데 세상에 그대 없다고 그렇게 여길 순 있지만 그대 없는 사람 이라기엔 내 안에 너무 있잖아 그댈 비워내면 나도 남아 날 수 없어 이게 사랑이었나 봐 떼어지지 않는 두 사람 그렇게 아프게 하고 거친 말 쏟아 부으며 우리가 했던 일은 모두 사랑이었는데 세상에 그대 없다고 그렇게 여길 순 있지만 그대 없는 사람 이라기엔 내 안에 너무 있잖아 눈물 흐르고 또 흘러서 우릴 갈라놓으려 하지만 오히려 더 선명해져 와 눈부신 기억들만 더 아파할수록 보여 사랑이 그대가 있어야만 해 내 이름 불러줘야만 해 그대 날 잊고 산다면 나는 살아도 죽은 거니까 우리는 헤어져서는 안돼
20100906,트랙스,태양의 노래 (Running My Way),male,록/메탈,-,제이 (Jay Hong),정모 (JUNGMO),(주)SM엔터테인먼트,Break my day 손을 뻗어도 하늘은 멀고 태양은 저물어가 사랑 앞에 또 무릎 꿇고 난 한없이 무너져 가 무엇을 꿈꾸는지 누굴 위한 꿈인지 알 수 없지만 Running Running my way 한숨뿐인 세상에 울려 퍼지는 멜로디 붉은 태양이 떠오르는 곳 부서진 우리들의 꿈의 조각들이 단 하나의 빛이 되어 긴 어둠을 비춰주네 Just let it go 해답하나 없는 이 삶 속에 헛된 한 번의 나약한 꿈일지라도 외쳐본다 뜨거운 가슴의 울림을 참 높아 내 안의 벽 너무 많아 앞길의 적 이 세상의 정상에서 더 큰 한방을 날려 Bang 반복된 시련에 부딪힌대도 쓰러지진 않아 붉은 태양이 떠오르는 곳 부서진 우리들의 꿈의 조각들이 단 하나의 빛이 되어 긴 어둠을 비춰주네 Just let it go 해답하나 없는 이 삶 속에 헛된 한 번의 나약한 꿈일지라도 외쳐본다 뜨거운 가슴의 울림을 현실과 이상의 경계선에 멈춰서 버린 채로 눈을 감아봐도 Nobody knows just let it flow 저 하늘위로 홀로 걷는 이 길 끝에서 나 헛된 한번의 나약한 꿈일지라도 외쳐본다 뜨거운 가슴의 울림을
20100125,트랙스,가슴이 차가운 남자 (Let You Go),male,"발라드, 록/메탈",-,제이 (Jay Hong),정모 (JUNGMO),(주)SM엔터테인먼트,하얗게 흐려진 그림 속 추억의 책장 속 우린 그저 스쳐간 안녕 돌아와 끝내 말 못하고 시간 틈새로 흘러 점점 멀어진 기억 몇번의 계절 지나 마주한 두 눈동자 아무말도 못하고 가슴이 차가운 남자가 울어요 이별에 모질던 그녀도 우네요 바래진 추억 유리조각에 베인 상처 흔적만 남아 초라하네요 파랗게 질려버린 하늘 굳어버린 입술 울컥 그립다 널 외치고 미련의 엉킨 인연의 끈 차마 풀지 못하고 다시 묻어두네요 먹먹한 가슴이 참지 못하고 달려 멀어진 니 등뒤로 가슴이 차가운 남자가 울어요 이별에 모질던 그녀도 우네요 바래진 추억 유리조각에 베인 상처 흔적만 남아 머물러 있는걸 the stay stay again the stay stay again 가슴이 차가운 남자가 울어요 이별에 모질던 그녀도 우네요 바래진 추억 유리조각에 끊긴 눈물속에 시간을 다시 묶어둘게 to tied 모르죠 이별한 남자의 눈물 못견디게 널 맴돌던 지친 한숨도 지독한 그리움 목 조르던 엉킨 우리 둘의 추억을 슬픈 하늘에 보내둘게
20100125,트랙스,One Night,male,록/메탈,-,"CAYTON, CHRIS","CAYTON, CHRIS",(주)SM엔터테인먼트,점점 자주 너와 시선이 마주쳐 야릇하게 묘한 웃음을 넌 흘려  두근대는 너의 가슴이 날 알아 봐 더 숨겨 봐야 소용없잖아    흔들리는 불빛 아래 moving 시끄러운 음악 속에 waiting 날 바라보고 있다는 걸 알아  너의 곁에 그 사람 몰래 눈치 채지 못 하게 몰래 넌 조심스레 내 맘을 훔쳐    조금은 비밀스럽게 오늘은 비밀스럽게 내 품에 안겨  이 밤은 너를 버리고 이 밤은 모두 잊고서 사랑에 빠져  마음이 가는 대로 해 봐     그의 손을 뿌리치고 나와 봐 너를 가둔 자릴 박차고 나와  그때부터 은밀한 게임이 시작돼 넌 이미 벗어날 수 없잖아    그에게 안겨도 지루한 듯 그의 농담에도 지루한 듯 네 마음이 그를 떠난 게 보여  내겐 좀 더 솔직히 show me 이젠 좀 더 다가와 tell me 널 사로잡은 날 원한다고    조금은 비밀스럽게 오늘은 비밀스럽게 내 품에 안겨  이 밤은 너를 버리고 이 밤은 모두 잊고서 사랑에 빠져  마음이 가는 대로 해 봐     꿈을 꾼 것처럼 거짓말처럼 기억마저 내일은 지워져 One night    조금은 비밀스럽게 오늘은 비밀스럽게 내 품에 안겨  이 밤은 너를 버리고 이 밤은 모두 잊고서 사랑에 빠져  마음이 가는 대로 해 봐     조금은 비밀스럽게 오늘은 비밀스럽게 내 품에 안겨  이 밤은 너를 버리고 이 밤은 모두 잊고서 사랑에 빠져  마음이 가는 대로 해 봐   Tonight It's only you and I
20100125,트랙스,송인 (Goodbye Lover),male,록/메탈,-,신민철,신민철,(주)SM엔터테인먼트,나빠요 어떻게 나를 두고 가나요  슬프고 슬프다 눈물이 마르고    나 혼자 남겨지기 싫어서 그대를 따라 나선다면  뭐라고 할까요    시간은 지나고 아물때도 되었건만  아프고 아프다 상처가 덧나고  맴돌듯 그대 떠난 자리에 남겨진 초라한 내 삶에  흔적들 마저도    남김없이 가져가세요  이제 떠나 가세요  가라고 애원을 해도 내안에서 왜 웃고 있나요  왜 이렇게 괴롭히나요  나를 잘 알잖아요  그대가 곁에 없는 난 바보란걸    하늘 위 그대도 날 지우길 바래요  지우고 지워도 번지는 기억에   이제는 견딜수가 없어서  날 보며 웃는 그 못습이 마지막이라고    남깁없이 가져가세요  이제 떠나 가세요  가라고 애원을 해도 내안에서 왜 웃고 있나요  왜 이렇게 괴롭히나요  나를 잘 알잖아요  그대가 곁에 없는 난 바보죠    지난 시간 우리 이상의 기억도  더 파고드는 아픔이 되어  우리 이제 그만해요  나를 놓아주세요    사랑했다면 제발 도와주세요  조금은 편해질까봐 그대 이름도 지우려해요  날 그렇게 사랑했나요 아직 사랑하나요    이젠 그 곳에서 만나요
20100125,트랙스,아직은... 나 (I Can Change),male,록/메탈,-,박근철,박근철,(주)SM엔터테인먼트,있잖아 아까부터 내게 신경질적이잖아  그렇잖아  있잖아 아까부터 너 생각나는 대로 말하고 있잖아  난 하지만  그런 너와라도 웃을 수 있어  허름한 모습에도 나를 알아본 너  그래서 그런 네가 소중하니까  Girl I'm gonna try so hard    아직은 나 그대 보다  더 부족할 수도 있겠지만  난 달라질꺼야  너를 위해 확신할 수 있어  난 할 수 있어  Oh 아직은 나 그대에게  해줄 수 있는건 많진 않지만  이것만 알아줘  너를 위해 살아갈꺼야    네곁에 내가 없다고 내안에 네가 없는건 아냐  Oh 아니야  어디에 있더라도 너를 위해 노력하는건 Oh 알아줘  난 하지만  투정하는 너에게도 웃을 수 있어  허름한 모습에도 나를 알아본 너  그래서 그런 네가 소중하니까  Girl I'm gonna try so hard    아직은 나 그대 보다  더 부족할 수도 있겠지만  난 달라질꺼야  너를 위해 확신할 수 있어  난 할 수 있어  Oh 아직은 나 그대에게  해줄 수 있는건 많진 않지만  이것만 알아줘  너를 위해 살아갈꺼야    스쳐지난 인연과 비교 말아줘  나 네곁에 머무를꺼야 영원히    아직은 나 그대 보다  더 부족할 수도 있겠지만  난 달라질꺼야  너를 위해 확신할 수 있어  난 할 수 있어  Oh 아직은 나 그대에게  해줄 수 있는건 많진 않지만  이것만 알아줘  Girl I'm gonna try so hard  Anytime Anywhere for YOU
20100125,트랙스,치유 (Healing) (Feat. Key From SHINee),male,록/메탈,-,휘성 (Realslow),정모 (JUNGMO),(주)SM엔터테인먼트,사랑과 이별로 꽃잎을 떼어보다 이별이 남아서  너를 버린 한심한 남자가  변했어 정했어 너하나 사랑하다 삶을 끝내기로 맘을 먹었어  맘의 천국을 내던졌던 타락한 바보야    날 구원해줘 너없인 한치앞도 못보는 불쌍한 내 두눈이 되줘  망가져 버려 너아닌 다른 사랑할 수 없는 날  너라는 병실에서 치료해줘        절대로 못찾게 완벽히 숨어도 되  평생을 널 찾아 내사랑을 증명해 볼테니  죽어서 뭍혀도 세상이 배울만큼 영원한 사랑을 약속해 줄게  나 씻고 싶어 니 진심을 외면한 죄들을    날 구원해줘 너없인 한치앞도 못보는 불쌍한 내 두눈이 되줘  망가져 버려 너아닌 다른 사랑 할 수 없는 날  너라는 병실에서 치료해줘        rap)  그녀가 지워지길 내 가슴에 접어두길  원하지 않는 바램들만 자꾸만 늘어가  사랑이라고 이건 집착이라는 생각에 생각에 생각에 미칠것만 같아  (날 용서해줘)   그대의 사랑앞에서 무릎꿇는 함께하는 순간을 꿈을 꾸는    이모든 순간들 수많은 말도 그 어떤것도   나 그대없이는 모두 무의미하다는걸 알아줘      내 혀끝이 닳아 버릴만큼 애원할 준비가 됐어   두팔을 니 다리에 감아 놓은 날 일으켜 용서해줘  날 구원해줘 너없인 한치앞도 못보는 불쌍한 내 두눈이 되줘  망가져 버려 너아닌 다른 사랑할 수 없는 날  너라는 병실에서 치료해줘    너라는 병실에서 치료해줘
20100125,트랙스,끝나지 않은 이야기 (Don`t Leave Me),male,록/메탈,-,배화영,고영조,(주)SM엔터테인먼트,편히 보낸다고 약속했는데  가슴은 그댈 놓치 못하네요.  기억들이 눈에 밟혀 한 순간도 잠들지 못하는 나는  어떡하나요.    남겨진 날들을 기다릴 뿐이죠.  그댈 잊어내는 일이 더 아픈데..    가지 말아요.   나를 혼자 두지 말아요.  우리 사랑했던 날 모두 다 잊은 건가요.  내 안엔 아직 그대 뿐인데  이대로 떠나면 안돼요..    어김없이 찾아오는 그리움에 오늘도 겠단 약속   어긴 나였죠.  두 눈을 가려도 눈물을 막아도  보고 싶은 맘은 항상 앞서는데    가지말아요.  나를 혼자 두지 말아요.  우리 사랑했던 날 모두 다 잊은 건가요.  내 안엔 아직 그대 뿐인데  이대로 떠나면 안돼요..    고갤 돌리면   소리 없이 한걸음에 내게 달려와   웃으며 안길 것 같은데.    좋았잖아요.   정말 사랑했었잖아요.  행복하란 그 말이 이렇게 쓸 줄 몰랐죠.  이별은 아직 낯설기만 한   내게는 믿기 힘든 말인데..    가지 말아요.  나를 혼자 두지 말아요.  우리 사랑했던 날 모두 다 잊은 건가요.  내 안엔 아직 그대 뿐인데.  이대로 떠나면 안돼요..    제발 날 떠나지 말아요..
20090820,트랙스,운명,male,-,-,김태희,김진훈,(주)SM엔터테인먼트,세상 어떤말도 부족한 사람 오늘 나를 살게 하는 사람 내가 웃는 이유 주는 사람 그사람이 그리워 아픈 눈물로만 그리는 사람 그래도 지울수 없는 사람 원하고 원해도 바라고 바래도 바라볼수 밖에 없는 사람 모두 버릴꺼야 다 버릴꺼야 널 기억하는 가슴까지도 잊을꺼야 다 잊어줄꺼야 사랑할수록 아픈사람 끝내 붙잡을수 없었던 사람 차마 사랑할수 없는 사람 나의 가지말란 한마디에 가지않을 너지만 목이 메이도록 너를 삼키고 무너진 가슴에 너를 묻고 감추고 감춰도 지우고 지워도 눈물될수밖에 없는 사람 모두 버릴꺼야 다 버릴꺼야 널 기억하는 가슴까지도 잊을꺼야 다 잊어줄꺼야 사랑할수록 아픈사람 아파우는건 나 나 하나면 돼 저 태양마저 삼킨다 해도 너아니면 안되는 내 사랑 다시 놓지 않아 모두 버릴꺼야 다 버릴꺼야 널 기억하는 가슴까지도 잊을꺼야 다 잊어줄꺼야 사랑할수록 나 사랑할수록 아픈사람
20090820,트랙스,목소리,male,-,-,전해성,전해성,(주)SM엔터테인먼트,아직 정리하지 못했어 나아직은 너만 사랑하니까 슬픈 사랑의 큰 눈물이라 혼자서 여기저기 걸어봐 모르겠어 정말 떠난 이유 왜 나를 떠나가려했는지 안녕이란 인사 너무 슬프잖아 이렇게 떠나가려 하지마 울려퍼져 빠빠빠 온통 귓가엔 그 목소리뿐 자꾸 맴돌아 귓가에 맴돌아 속삭이듯 나를 부르지만 울려퍼져 빠빠빠 온통 귓가엔 그 목소리뿐 자꾸 맴돌아 귓가에 맴돌아 속삭이듯 나를 부르지만 울려퍼져 아직 준비하지 못했어 나혼자서 해맬지 모르지만 내안에 숨쉬는 너라는 사람지킬게 믿어주면돼잖아 들리잖아 내 안 가슴안에 애타게 니 이름만 부르는 안녕이란 인사너무 슬프잖아 이렇게 떠나가려 하지마 울려퍼져 빠빠빠 온통 귓가엔 그 목소리뿐 자꾸 맴돌아 귓가에 맴돌아 속삭이듯 나를 부르지만 울려퍼져 빠빠빠 온통 귓가엔 그 목소리뿐 자꾸 맴돌아 귓가에 맴돌아 속삭이듯 나를 부르지만 울려퍼져
20090820,트랙스,그 자리에,male,-,-,김진훈,김진훈,(주)SM엔터테인먼트,그녀는 나빠요 아무일 없었던 것처럼 너무도 행복한 얼굴로 미소를 지으며 나를 바라봐요 그녀는 아파요 나만큼 정말 아픈거겠죠 알아요 이젠 늦었겠죠 그깟 내 눈물로 용서할 순 없겠죠 언제나 그 자리에 그 자리에 너만을 바라 보고만 있을게 그대없이는 단 한 순간이라도 숨을 쉴 수 없죠 이젠 나를 봐요 그대 사랑은 아파요 너무도 아픈 상처뿐이죠 하지만 그대 생각이 나서 너무 보고 싶어서 그댈 찾았나봐요 언제나 그 자리에 그 자리에 너만을 바라보고만 있을게 그대없이는 단 한 순간이라도 숨을 쉴수없죠 이젠 나를 봐요 그대 이젠 돌아와죠요 그대 모습들 그대 미소 하나 까지도 행복했던 기억도 사랑했던 순간도 모두다 느낄수있게 언제나 그 자리에 그 자리에 터질 것 같은 내맘이 들리니 그대 없이는 단 한 순간이라도 나는 살수없죠 다시 돌아와요 그대
20090723,트랙스,운명,male,발라드,-,-,-,(주)SM엔터테인먼트,세상 어떤 말도 부족한 사람 오늘 나를 살게 하는 사람 내가 웃는 이유 주는 사람 그 사람이 그리워 아픈 눈물로만 그리는 사람 그래도 지울 수 없는 사람 원하고 원해도 바라고 바래도 바라볼 수 밖에 없는 사람 모두 버릴거야 다 버릴거야 널 기억하는 가슴까지도 잊을거야 다 잊어줄거야 사랑할수록 아픈 사람 끝내 붙잡을 수 없었던 사람 차마 사랑할 수 없는 사람 나의 가지말란 한마디에 가지않을 너지만 목이 메이도록 너를 삼키고 무너진 가슴에 너를 묻고 감추고 감춰도 지우고 지워도 눈물 될 수 밖에 없는 사람 모두 버릴거야 다 버릴거야 널 기억하는 가슴까지도 잊을거야 다 잊어줄거야 사랑할수록 아픈 사람 아파 우는 건 나 나 하나면 돼 저 태양마저 삼킨다해도 너 아니면 안되는 내 사랑 다신 놓지않아 모두 버릴거야 다 버릴거야 널 기억하는 가슴까지도 잊을거야 다 잊어줄거야 사랑할수록 난 사랑할수록 아픈 사람
20090723,트랙스,목소리,male,발라드,-,-,-,(주)SM엔터테인먼트,아직 정리하지 못했어 나 아직은 너만 사랑하니까 슬픈 사랑의 큰 눈물이라 혼자서 여기저기 걸어봐 모르겠어 정말 떠난 이유 왜 나를 떠나가려했는지 안녕이란 인사 너무 슬프잖아 이렇게 떠나가려하지마 울려퍼져 빠빠빠 온통 귓가엔 그 목소리뿐 자꾸 맴돌아 귓가에 맴돌아 속삭이듯 나를 부르지만 울려퍼져 빠빠빠 온통 귓가엔 그 목소리뿐 자꾸 맴돌아 귓가에 맴돌아 속삭이듯 나를 부르지만 울려퍼져 아직 준비하지 못했어 나 혼자서 해맬지 모르지만 내안에 숨쉬는 너라는 사람 지킬게 믿어주면돼잖아 들리잖아 내 안 가슴안에 애타게 니 이름만 부르는 안녕이란 인사 너무 슬프잖아 이렇게 떠나가려 하지마 울려퍼져 빠빠빠 온통 귓가엔 그 목소리뿐 자꾸 맴돌아 귓가에 맴돌아 속삭이듯 나를 부르지만 울려퍼져 빠빠빠 온통 귓가엔 그 목소리뿐 자꾸 맴돌아 귓가에 맴돌아 속삭이듯 나를 부르지만 울려퍼져
