년도,가수,제목,남녀,장르,최고순위,작사가,작곡가,소속사,가사
20080320,트랙스,희철/시원/신동♡ Rhapsody,male,J-POP,-,-,-,(주)SM엔터테인먼트,廣がる空の果てまで  히로가루소라노하테마데  펼쳐지는 하늘 끝까지    想いが屆く氣がして  오모이가토도쿠키가시테  내 마음이 닿을 것 같아서    言葉にならない氣持ちを奏でる  코토바니나라나이키모치오카나데루  말로 표현할 수 없는 기분을 읊조려 본다    翼を廣げて　飛び立つその時がくるまでは  쯔바사오히로게테 토비다츠소노토키가쿠루마데와  날개를 펴고 날아 오를 시간이 올 때까지는    胸に響く Rhapsody  무네니히비쿠 Rhapsody  가슴에 울리는 Rhapsody    靜けさに抱かれて  시즈케사니다카레테  정적 속에 안겨    壞れそうな  코와레소오나  부서질 듯한    愛を包む Melody  아이오쯔츠무 Melody  사랑을 감싸는 Melody    I want you to hold me このまま  I want you to hold me 코노마마  I want you to hold me 이대로    時間を忘れて  지칸오와스레테  시간을 잊고    この世界が終わるまで  코노세카이가오와루마데  이 세상이 끝날 때까지    君を愛して  키미오아이시테  널 사랑하고    流れる時が刻む silent strokes  나가레루토키가키자무 silent strokes  흐르는 시간을 새기는 silent strokes    雨を求める薔薇の吐息のように  아메오모토메루바라노토이키노요오니  비를 기다리는 장미의 한숨처럼    靜かに花びらを震わせて  시즈카니하나비라오후루와세테  조용히 꽃잎을 떨리게 해 줘    赤く染まるまで　欲望が愛しさに變わるまでは  아카쿠소마루마데 요쿠보오가이토시사니카와루마데와  빨갛게 물들 때까지 욕망이 사랑스럽게 변할 때까지는    胸に響く Rhapsody  무네니히비쿠 Rhapsody  가슴에 울리는 Rhapsody    靜けさに抱かれて  시즈케사니다카레테  정적 속에 안겨    壞れそうな  코와레소오나  부서질 듯한    愛を包む Melody  아이오쯔츠무 Melody  사랑을 감싸는 Melody    I want you to hold me このまま  I want you to hold me 코노마마  I want you to hold me 이대로    時間を忘れて  지칸오와스레테  시간을 잊고    この世界が終わるまで  코노세카이가오와루마데  이 세상이 끝날 때까지    君を愛して  키미오아이시테  널 사랑하고    胸に響く Rhapsody  무네니히비쿠 Rhapsody  가슴에 울리는 Rhapsody    靜けさに抱かれて  시즈케사니다카레테  정적 속에 안겨    壞れそうな  코와레소오나  부서질 듯한    愛を包む Melody  아이오쯔츠무 Melody  사랑을 감싸는 Melody    I want you to hold me このまま  I want you to hold me 코노마마  I want you to hold me 이대로    時間を忘れて  지칸오와스레테  시간을 잊고    この世界の終わりに  코노세카이노오와리니  이 세상의 끝에    永遠の詩を響かせて  에이엔노우타오히비카세테  영원의 노래를 울려 줘    I love you
20070124,트랙스,Find The Way,male,J-POP,-,-,-,(주)SM엔터테인먼트,자와메키가 아후레테루 마치니우모레테 히토도키노 키라메키사에 미우시낫테타 자라츠이타 카제노나카 키미니데앗테 키즈츠이타 히비노이미니 얏토키즈이탄다 코와레 카케테이타 유메노 카타치 히토츠 히토츠 츠미아게요우 Find The Way 키미가 이레바 아타라시이 키세키 오오코세루 후타리 코코로 타바네타라 호도케나이탓타히토츠노 키즈나가 우마레루 코레카라모마타카베니 부츠카루다로 소노타비니 코노료우테데 코와세바이이 후리무케바 아타타카이 에가오니아에루 소레다케데 난도모닷테 야미오츠라누이테이쿠 다이세츠나모노오 미츠케타토키 히토와이마오 코에테유쿠 Find The Way 이타미 사에모 이키테이루 아카시니나루카라 히카루 카제오 세비우케테 마모루노와탓타히토츠노 카와라나이 이토시사 카사네아와세타 후타리노 네가이가 에가키다스미라이오 Find The Way 키미가 이레바 아타라시이 키세키 오오코세루 후타리 코코로 타바네타라 호도케나이탓타히토츠노 키즈나가 유루가나이탓타히토츠노 키즈나가 우마레루
20070124,트랙스,Cold Rain ~初雨~ / Cold Rain ~Hatsuame~ (Cold Rain ~첫비~),male,J-POP,-,-,-,(주)SM엔터테인먼트,memory 過ぎ去りし日?時は果て色も消えて  memory 스기사리시히비 토키와하테 이로모키에테  memory 지나간 날들의 시간은 점점 빛을 잃어가  僕は今でも記憶の海漂い?ける  보쿠와 이마데모 키오쿠노우미 타다요이츠즈케루  나는 지금도 기억의 바다를 떠돌고 있어  貴方の愛は冬の雨になり僕を濡れた心を凍らせて  아나타노 아이와 후유노아메니나리 보쿠노 누레타 코코로오 코오라세테  너의 사랑은 겨울비가 되서 나를 적셨던 마음을 얼게 해  他の誰をもう愛せないように眠りの中閉じ?めたまま  호카노다레오모 아이세나이요우니 네무리노나카 토지코메타마마  다른 누군가를 더 이상 사랑하지 않도록 꿈속에서 깨어나지 않은 채  memory 貴方を抱いて見つめ合い笑った日?  memory 아나타오다이테 미츠메아이 와랏타히비  memory 너를 안고서 서로 바라보며 웃었던 날들  僕は夢から?めたくないと願っていたよ  보쿠와 유메카라 사메타쿠나이토 네갓테이타요  나는 꿈에서 깨지 않길 바랬어  ?はいつか冬の雨になり思い出だけ身?を打ち付けて  나미다와이츠카 후유노아메니나리 오모이데다케 가라다오 우치츠케테  눈물은 언젠가 겨울비가 되서 추억만이 몸을 감싸고  このまま遠く流されるのなら深い海で貴方を思う  코노마마 토오쿠 나가사레루노나라 후카이우미데 아나타오오모우  이대로 멀리 흘러 갈 수 있다면 깊은 바다 속에서 너를 생각해  やがてこの夢に夜明けが?て目?める時  야가테코노 유메니 요아케가키테 메자메루토키  이제 곧 새벽이 와서 이 꿈에서 깨어났을 때  貴方は?け?の?もりさえ全て消してしまったよ  아나타와 누케카라노 누쿠모리사에 스베테케시테시맛타요  니가 남겨 둔 따뜻함조차 모두 사라져 버렸어  冬の雨は冷たくて僕を濡れた心を凍らせる  후유노아메와츠메타쿠테 보쿠노누레타 코코로오 코오라세루  겨울비는 차가워서 나를 적셨던 마음을 얼게 해  他の誰をもう愛せないように眠りの中閉じ?めたまま  호카노 다레오모 아이세나이요우니 네무리노나카 토지코메타마마  다른 누군가를 더 이상 사랑하지 않도록 꿈속에서 깨어나지 않은 채  memory 光へと say good-bye cold rain  memory 히카리에토 say good-bye cold rain  memory 빛을 향해 say good-bye cold rain
20070119,트랙스,Angels (Ballad Ver.),male,-,-,김정배,김정배,(주)SM엔터테인먼트,어디인지 기억났니 너와 내가 같이 꿈을 나눴던 그 별을 까마득하게 보이는 너를 찾게했던 네 표정도 날아가도 괜찮아요 지켜봤던 너의 날개를 달고서 언제나 여기 있어요 이제 나의 품에 너를 꼭 안아줄꺼야 baby just wanna hold you 나의 손을 잡아요 나의 그대는 날봐요 어디인지 기억했니 하얀 구름 보다 너의 맑았던 음성을 까마득하게 보였던 너를 잡을수 있던 순간도 날아봐도 괜찮아요 지켜왔던 너의 날개를 달고서 언제나 여기 있어요 이제 나의 품에 너를 꼭 안아줄꺼야 baby just wanna hold you 나의 손을 잡아요 나의 그대는 날 봐요
20061214,트랙스,초우 (初雨) (Drama Ver.),male,-,-,KENZIE,KENZIE,(주)SM엔터테인먼트,한참을 나는 어리석게도 잊으려고는 애쓰지 않았어 맘속에 위험하게 남은 욕심들을 더는 허락하지 마요 사람들이 모르게 혼자만 울 수 있겠죠 보내는 사람이 그러듯 이제 나에게 술에 취한 밤들이 차라리 쉬울거라고 생각없이 편히 잠들 수 있으니까 얼마나 잠이 들었던건지 아침은 내게 의미가 없네요 사랑은 미워질 때 더욱 아픈 것임을 이제 깨달은걸요 사람들이 모르게 그댈 찾아가 보겠죠 버려진 사람이 그러듯 그립다 못해 열에 들뜬 날이면 미친 척 비를 맞아요 멀쩡한 나라면 죽을 것만 같아서 이젠 나를 모르겠죠 나처럼 약하진 않을 사람이니 예전처럼 살 순 있겠지 하지만 가슴이 비워진 껍질뿐인 나인데 변해가는 모습 욕하지 마요 보내는 사람이 그러듯 이제 나에게 술에 취한 밤들이 차라리 쉬울거라고 생각없이 편히 잠들 수 있으니까 더이상 미련없네요 이젠 안녕
20061212,트랙스,Alone,male,발라드,-,태훈,LeeOn,(주)SM엔터테인먼트,굳게 닫힌 너의 문틈에 빛이 새어나오면 지나간 그 추억을 새며 기다리는데 혹시나 오진 않을까 닫힌 문을 열어줄때면 다른 어디에서도 가수는 입이 없어도 소리지르며 너를 찾고 있는데 그대라는 감옥안에서 내사랑 따위는 보이지 않게 멀리 있었으니까 행복할테니까 그토록 사랑했던게 나 죄라면 날 풀어주겠니 더이상은 이 세상에서 살아갈 자신 없으니 도려내고만 싶었던 나의 상처를 가져가줘 그대라는 감옥안에서 내사랑 따위는 보이지 않게 멀리 있었으니까 행복할테니까 그토록 사랑했던게 나 죄라면 날 풀어주겠니 더 이상은 이 세상에서 저지를 죄가 없으니 워 너에게 난 아무것도 아무것도 아닌거니
20061102,트랙스,GO GO,male,-,-,박준하,김성수,(주)SM엔터테인먼트,all right ha 작은 미소가 날 설레게 해 어떤 바램도 필요 없어 누가 뭐라해도 상관없어 귀를 막고 go go 그모습 그대로 지금의 내 전부는 너니까 날 받아줘 제발 니 품에 안기게 breakfast 부드러운 커피 향 꽃잎의 노래 속삭이고 밤 깊어 질때면 별빛에 몸을 실어 loving loving 바라는 그대로 지금의 내 전부는 너니까 날 받아줘 제발 니 품에 안기게 우 니 눈빛에 몸이 녹아들었어 alright 니 모습 바라보면 심장이 터질 것 같아 go go 필요없어 난 세상 무엇과도 바꿀 수가 없는데 지난 과거도 문제없어 아무려면 어때 그모습 그대로 지금의 내 전부는 너니까 니 품에 안길게 날 받아줘 제발 나의 사랑 forever 손을 잡아 그대여
20061102,트랙스,My Tears,male,-,-,조윤경,홍석,(주)SM엔터테인먼트,늘 힘에 겨운 하루에 지친 날 따라오는건 내 발걸음을 향해 좀 더 길어진 그림자 먼 기억속의 시간 문득 찾아올때면 내 뒷모습들을 향해 더 자라난 후에 세상 속에 나를 위한 길이 어디쯤인지 누군가 꿈에서라도 가르쳐 주길 늘 거친 세상에 다시 날 일으킨건 내 어린 날을 닮아 더 무모한 용기 아주 가끔 나를 가둔 나약함을 모른 척 외면한 웃음 뒤에서 눈물 흘릴게 my tears 세상 속에 나를 위한 길이 어디쯤인지 누군가 꿈에서라도 가르쳐 주길 my way 아주 가끔 나를 가둔 나약함을 모른 척 외면한 웃음 뒤에서 눈물 흘릴게 my tears
20060823,트랙스,Resolution,male,J-POP,-,-,-,(주)SM엔터테인먼트,スコ-ルの後で 燃え立つ空のように 濡れた身?は 熱が溢れ出そうで  스코-루노아토데 모에타츠소라노요우니 누레타카라다와 네츠카아후레데소우데  Squall의 후에 타오르는 하늘과 같이 젖은 몸은 열이 넘쳐 나올 것 같고      騷がしい夢が連れてきた次の波は ?夏を抱いた光だった  사라가시이유메가츠레테키타츠기노나미와 마나츠오다이타히카리닷타  시끄러운 꿈이 데려 온 다음의 물결은 한 여름을 안은 빛이었어      RESOLUTION 高く 輝く場所へ 翼は導く  RESOLUTION 타카쿠 카가야쿠 바쇼에 츠바사와 미치비쿠  RESOLUTION 높게 빛나는 장소에 날개는 인도하고      熱視線の中で 求め?けて ?るがない ??へ go my way  네츠시센노나카데 모토메츠츠케테 유루가나이시은지츠에 go my way  뜨거운 시선 중에서 계속 요구해 흔들리지 않는 진실에 go my way      ?ち潮の今 始まる新しい日? それは誰にも 邪魔させないシナリオ  미치치오노이마 하지마루아타라시이히비 소레와다레니모 쟈마사세나이시나리오  가득찬 밀물의 지금 시작되는 새로운 날들 그것은 누구에게도 방해받지 않는 시나리오      乾いた喉に 流し?む水のように 未?が刺激欲しがってる  카와이타노도니 나카시코무미즈노요우니 미라이가시게키시갓테루  마른 목에 마시는 물과 같이 미래가 자극을 원하고 있어      RESOLUTION ?く 明日の先へ 世界は手招く  RESOLUTION 츠요쿠 아시타노사키에 세카이와테마네쿠  RESOLUTION 강하게 내일의 앞엔 세계는 손짓해      迷いを消えして ?け?けてゆく 永遠と自由への go my way  마요이오키에시테 카케누케테유쿠 에이에은토지유우에노 go my way  망설임을 버리고 달려나가 영원과 자유에게로의 go my way      朝?けに舞う　?かな時間のヴェ-ルを ああ解き放ち 信じるまま果てまで  아사야케니마우 하루카나도키노베루오 아아토키하나치 신지루마마하테마데  아침 노을에 춤추는 아득히 먼 시간의 베일을 아아 풀어놓아 믿으며 끝까지      RESOLUTION 高く 輝く場所へ 翼は導く  RESOLUTION 타카쿠 카가야쿠 바쇼에 츠바사와 미치비쿠  RESOLUTION 높게 빛나는 장소에 날개는 인도하고      熱視線の中で 求め?けて ?るがない ??へと  네츠시센노나카데 모토메츠츠케테 유루가나이시은지츠에토  뜨거운 시선 중에서 계속 요구해 흔들리지 않는 진실과      迷いを消えして ?け?けてゆく 永遠と自由への go my way  마요이오키에시테 카케누케테유쿠 에이에은토지유우에노 go my way  망설임을 버리고 달려나가 영원과 자유에게로의 go my way
20060823,트랙스,Criminal Scream,male,J-POP,-,-,-,(주)SM엔터테인먼트,"振り返れば ユメの狹間で 搖れて危うい キミの記憶  후리카에레바 유메노하자마데 유레테아야우이 기미노키오쿠  되돌아보면 꿈의 좁은 사이에 흔들리는 위험한 너의 기억    I gotta scream Scream Scream Scream  Tilll I can reach my dream No matter where you go    Never say die, Eyes キミの目が 祈るようにぼくらを見ていた  Never say die, Eyes 키미노메가 이노루요우니보쿠라오미테이타  Never say die, Eyes 너의 눈이 빌듯이 우리를 보고 있었어    A breach of faith to you なにひとつできなくて 闇雲に投げつけたサヨナラ  A breach of faith to you 나니히토츠데키나쿠테 야미쿠모니나게츠케타사요나라  A breach of faith to you 뭐 하나 할 수 없어서 어둔 구름에 내던진 안녕    忘れたよね? 思い出させちゃ? 罪になるかい? 答えてくれ  와스레타요네? 오모이다사세챠? 츠미니나루카이? 코타에테쿠레  잊었지? 생각나게 하면? 죄가 될까? 대답해 줘    I gotta scream Scream Scream Scream  Tilll I can reach my dream No matter whom you love    Never say die, Why? かなえなきゃ あの日?が噓に?わるから  Never say die, Why? 카나에나캬 아노히비가우소니카와루카라  Never say die, Why? 만족시키지 않으면 매일매일 바뀌기 때문에    I don't tell a lie 流星の尾のような 想い出になんかさせないから  I don't tell a lie 유우세이노오노요우나 오모이데니난카사세나이카라  I don't tell a lie 유성의 꼬리와 같은 추억에 뭔가 시키지 않으니까    Still in your eyes いまもどこかで見つめてる瞳が  Still in your eyes 이마모도코가테미츠메테루히토미가  Still in your eyes 지금도 어디선가 쳐다보고있는 눈동자가    消えかかる夢のカタチを 確かめるシルシ  키에카카루유메노카타치오 타시카메루시루시  사라져가는 꿈의 형태를 확인하는 증표    Never say die, Eyes キミの目が 描いてたぼくらのミライを  Never say die, Eyes 키미노메가 에가이테타보쿠라노미라이오  Never say die, Eyes 너의 눈이 그리고 있었던 우리의 미래를    Let me show you now 遲過ぎるいいわけど いわれたっていいさ かまわない  Let me show you now 오소스기루이이와케도 이와레탓테이이사 카마와나이  Let me show you now 느린 건 좋지만 아니라고 해도 좋아 상관 없어    この?が その胸に 響くまでずっと  코노코에가 소노무네니히비쿠마데즛토  이 소리가 그 가슴에 들릴 때까지 계속    Screaming to reach you この胸をしめつける感情が キミに?わるまで  Screaming to reach you 코노무네오시메츠게루카은죠우가 키미니츠타와루마데  Screaming to reach you 이 가슴을 압박하는 감정이 너에게 전해질 때까지"
20060718,트랙스,영혼을 감싸안아 (Embrace One`s Soul),male,록/메탈,-,Takashi Matsumoto (松本隆),Himuro Kyosuke,(주)SM엔터테인먼트,저 빗방울에 비친 마을 그림자 맴돌면 잠든 너의 긴 눈썹 아름답게 그리며 드리우는 이 아침에 대충 살던 삶조차 비웃었던 나인데 너의 심장소리는 내 삶의 시계 되어 오늘을 또 살고 있어 시트의 파도 사이를 떠도는 우린 두 개의 작은 배 옷을 벗어 놓은 채 컵에 커피를 따라놓고 나의 영혼을 감싸 안아줘 도시속에 물들어 버린 나의 가슴속 얼룩진 흔적 너의 손톱으로 다 지워줘 나의 영혼을 감싸 안아줘 오직 내 자신만 사랑하던 이기적으로 제멋대로 살던 내가 너의 품에 안기게 강렬했었던 여름 흰 모래와 너의 Kiss 더위마저 사라져 투명해진 가을에 남겨진 건 사랑뿐 세상에 부딪혀 힘들 때 네가 옆에 있다는 것만이 내 아픔을 나눌 수 있다면 그걸로 충분하지 나의 영혼을 감싸 안아줘 너의 따뜻한 두 손으로 멋도 없이 포장도 없이 진실앞에 내가 서있어 나의 영혼을 감싸 안아줘 나의 마음들을 읽어줘 말할 수 없는 소중하게 아끼던 말 나의 눈을 바라보네 지금처럼 영원하게
20101115,트랙스,Tell Me Your Love,male,국내드라마,-,기승주,조용훈,(주)SM엔터테인먼트,눈부시던 그때 tell me your love 그대가 없는 나는 혼자인 걸 fall in your love 멀어진 기억속에 흩어진 널 I love u love u love u 내 손을 놓지는마 Oh I love u love u Always tell me your love 눈 감으면 그때의 바람 그때 향기가 날 감싸안아 떨리던 순간 꿈처럼 아련한 기억속으로 이끌려 아나요 꿈만 같은걸 너와 함께한 그 시간에 공기까지도 달콤하다는걸 눈부시던 그때 tell me your love 그대가 없는 나는 혼자인 걸 fall in your love 멀어진 기억속에 흩어진 널 I love u love u love u 내 손을 놓지는마 Oh I love u love u Always tell me your love 언젠가는 지금의 우릴 잊고 살아갈 수도 있겠지 하지만 지난 시간의 무게보다 너를 사랑할꺼야 내 눈에 니가 번져서 어떤 것도 볼 수 없음을 오직 너만이 내 맘속에 있어 눈부시던 그때 tell me your love 그대가 없는 나는 혼자인 걸 fall in your love 멀어진 기억속에 흩어진 널 I love u love u love u 내 손을 놓지는마 Oh I love u love u Always tell me your love 그대도 이런 맘이겠죠 들려요 하루종일 그대음성 나른한 향기같은 시간은 나와 같겠죠 눈부시던 그때 tell me your love 그대가 없는 나는 무의미한걸 fall in your love 담겨진 추억속에 유일한 널 I love u love u love u 내 손을 놓지는마 Oh I love u love u Always tell me your love oh I love u love u always tell me your love
20100906,트랙스,오! 나의 여신님 (Oh! My Goddess),male,록/메탈,-,제이 (Jay Hong),Jaakko Manninen,(주)SM엔터테인먼트,so ONE 하던 TWO my girl THREE 눈이 부신 로렐라이 oh hey lady FOUR my love FIVE 5분만 만나줄래 지겨웠던 이별 상처 눈물 모두 Stop 너 원한다면 어디든지 I will go Uh 널 바래 널 원해 나 Wanna Wanna 원해 널 눈이 눈이 너만 바라보게 하는 Girl 내 맘이 맘이 너를 가득 채워버린 걸 받아줘 내 맘 애타게 널 Waiting Baby 눈이 눈이 너만 바라보고 있는 Boy 내 맘이 맘이 그녀 마음 뺏어버린 Boy Oh 제발 난 더 지치는 건 No More Baby 오 나의 여신 I keep waiting I keep calling 왜 말이 말이 없는 걸까 모든 걸 다 준대도 부족한 Girl 기다리던 너의 전화 대답 모두 Stop 날 두근두근 애태우던 심장마저 Stop 시계도 시간도 널 조마조마 기다려 내 눈이 눈이 너만 바라보게 하는 Girl 내 맘이 맘이 너를 가득 채워버린 걸 받아줘 내 맘 애타게 널 Waiting Baby 눈이 눈이 너만 바라보고 있는 Boy 내 맘이 맘이 그녀 마음 뺏어버린 Boy Oh 제발 난 더 지치는 건 No More Baby 오 나의 여신 워우워우워 와 내게로 워우워우워 Oh Baby Girl Baby Baby 내 맘 모두 알아버린 Girl I love you love you 내 맘 모두 가져버린 걸 내 품에 널 꼭 영원히 안을게 Oh Baby Baby 세상모두 가진 너의 Boy 나 너를 너를 영원토록 지켜주는 Boy Only One 너만 바라볼게 Love You Venus 오 나의 여신
20100906,트랙스,Let`s Play,male,록/메탈,-,임서현,정모 (JUNGMO),(주)SM엔터테인먼트,또 누구였는지 전활 왜 꺼둔 건지 묻는 것도 지겨워 손가락 다 세도 모자란 남자들 그 중에 난 사양할게 You are so crazy You make me crazy 아직도 넌 나를 몰라 너의 그 손길과 입술에 나 역시 흥미 잃은 지 오랜 걸 Bye Bye 이제 모두 다 가져가 너에게 취해서 비틀댄 시간들까지도 Bye 남은 사랑 따윈 없어 우연도 피해 줘 꿈에도 보이지마 Get away 저 문을 열고서 들어 올 순간부터 늘어 놓을 거짓말 그들에게 줬던 그 눈빛으로 날 보는 것도 소름 돋아 You are so crazy You make me crazy 네 멋대로 하고 살아 달콤한 숨결로 손짓 해 네 앞에 무릎 꿇린 남자들과 Bye Bye 이제 모두 다 가져가 너에게 취해서 비틀댄 시간들까지도 Bye 남은 사랑 따윈 없어 우연도 피해 줘 꿈에도 보이지마 Get away 그래도 한 순간 사랑한 너라서 어떻게든 기다릴까도 했지만 못 고쳐 안 고쳐 난 지쳐 he end I wanna go away Bye Bye 이제 모두 다 가져가 너에게 취해서 비틀댄 시간들까지도 Bye 남은 사랑 따윈 없어 우연도 피해 줘 꿈에도 보이지마 Get away Bye Bye 이제 모두 다 끝났어 나 같은 남자를 놓치고 눈물이 나도록 넌 후회하게 될테니까 이제 난 너 없는 자유를 누릴게 Let's play
20100906,트랙스,자기야 (Jagiyah),male,록/메탈,-,조윤경,MARK STEIN,(주)SM엔터테인먼트,마지막 널 만나는 기회 웃으며 넌 내게 말하네 Good Bye 멀어져가 Some Memories 함께 원하던 The Memories 사랑에 빠졌던 그 때 모두 꿈처럼 너무 멀게만 와버린 걸까 너무 빠르게 다 간 걸까 이제 다신 다신 못 부를 자기야 자기야 마지막 널 만나는 곳에 전화 걸어 너를 부르네 내게 돌아와줘 너무 아름다운 널 멈추게 하고 싶어 아직 나의 남은 사랑 Without You 너무 멀게만 와버린 걸까 너무 빠르게 다 간 걸까 이제 다신 다신 못 부를 자기야 자기야 네 안에 날 잊지마 Oh No Oh No Oh No No 먼 날에도 기억해 나를 잊지 마 너무 멀게만 와버린 걸까 너무 빠르게 다 간 걸까 이제 다신 다신 못 부를 자기야 자기야
