년도,가수,제목,남녀,장르,최고순위,작사가,작곡가,소속사,가사
20000901,파이브,How Do Ya Feel,male,POP,-,-,-,-,"We won't stop, we don't even know how to stop You see with positive minds, we create positive vibes And with those positive vibes, we create positive lives So if there's something that ya want, you know you gotta get it Don't ever forget it, cause someday you will regret it So keep on pushing for em, cause your dreams are your dreams And no matter how it seems, there will always be a means To get what you want, yo and where you're going to Now what'cha gonna do, I'm gonna leave that up to you We're gonna keep it going on now, take it to the top now Never gonna stop, even if we start to drop now Here we go again y'all, can you get with this flow Never wanna go slow so How do ya feel, you wanna feel alright Here's the deal, we got pure delight Alright, it's alright Wake you up until the morning light Shake you up before you sleep at night You wanna feel alright, we got pure delight They say I'm greedy but I still want more What you don't need to know, I keep behind closed doors Cos everything I buy can't be sold, and everything I touch turns to gold You see because I'm better than the next man I shine above all those who try to put me down, and pass it to the next man Who's the best night for keeping it tight Next time it comes around, make sure you do it right We're gonna keep it going on now, take it to the top now Never gonna stop, even if we start to drop now Here we go again y'all, can you get with this flow Never wanna go slow so How do ya feel, you wanna feel alright Here's the deal, we got pure delight Alright, it's alright Wake you up until the morning light Shake you up before you sleep at night How do ya feel, you wanna feel alright How do ya feel, we got pure delight How do ya feel, you wanna feel alright Here's the deal, we got pure delight Alright, it's alright Wake you up until the morning light Shake you up before you sleep at night How do ya feel, you wanna feel alright How do ya feel, we got pure delight How do ya feel, you wanna feel alright Here's the deal, we got pure delight Alright, it's alright Wake you up until the morning light Shake you up before you sleep at night How do ya feel, you wanna feel alright How do ya feel, we got pure delight"
20000901,파이브,Everyday,male,POP,-,-,-,-,"Everyday I got you on my mind Everyday I just keep it all inside You got me tripping Because I want you bad and you don't know But if you give me a chance, oh baby we'd find romance Come and tell me are you ready to go You got me tripping, now baby tell me what I gotta do Cause when I'm laying in my bed, and you pop into my head All I wanna do is get with you Everyday round and round I think about the times and the love I've found, oh baby, baby Everyday round and round My head is in the clouds and it won't be coming down, oh baby, baby Everyday I just can't find the time I just wanna say, a girl like you is hard to find You got me tripping Because I want you bad and you don't know But if you give me a chance, oh baby we'd find romance Come and tell me are you ready to go You got me tripping, now baby tell me what I gotta do Cause when I'm laying in my bed, and you pop into my head All I wanna do is get with you Everyday round and round I think about the times and the love I've found, oh baby, baby Everyday round and round My head is in the clouds and it won't be coming down, oh baby, baby Well there she goes again, running circles round my mind Yeah I know just what you're saying, but you know the girl is mine Well maybe I can get her, if I show her what I got What you got, I got double, c'mon give it a shot You trying to take my girl, trying to mess around with Mrs. Right No, but how can I be happy, when I dream of her at night There she is up in my head, every time I close my eyes So I think I'm gonna call her, just to see if she replies You got me tripping Because I want you bad and you don't know But if you give me a chance, oh baby we'd find romance Come and tell me are you ready to go You got me tripping, now baby tell me what I gotta do Cause when I'm laying in my bed, and you pop into my head All I wanna do is get with you Everyday round and round I think about the times and the love I've found, oh baby, baby Everyday round and round My head is in the clouds and it won't be coming down, oh baby, baby Everyday round and round I think about the times and the love I've found, oh baby, baby Everyday round and round My head is in the clouds and it won't be coming down, oh baby, baby"
20000901,파이브,Mr Z,male,POP,-,-,-,-,"Excuse me, can you help me, straighten out my head I got a new friend by the name of Mr. Z Well what's wrong with that, don't you like what you see? Hmm... If I had a choice yo I'd rather be me You see he's kinda not like that kinda average kinda guy Kinda say what, make you kinda say why Did you see that? what he did to his cat? It's all big and fat,a nd now it wears caps Here we go again CHORUS Mr Zuvaloppa got a crazy life With a house on the corner for his kids and wife Works all day trying to make ends meet just the same as everybody does down his street Mr Zuvaloppa got a brand new car But he likes a little drink so he can't drive far he used to have a mini but he's six foot four Mr Zuvaloppa don't want it anymore Yo you gotta sit back, relax While I hit you with a tale of a guy Who would try, but he's always gonna fail M-I-S-T-E-R Z he doesn't realize that it wasn't really meant to be Him up at the top, he never wanna stop The fool up in the pool doin' a big belly flot Now ever sunbathing he could never get it right Cuz he even tried to do it in the middle of the night Here we go again CHORUS"
20000901,파이브,Sunshine,male,POP,-,-,-,-,"All I gotta do, is get it through to you You take my hand and let me lead you away Same old words again, he was just a friend That's what you told me, but you're my one and only If I tell you something now, I ask myself just how You came into my world, gotta keep on loving you So let the sun shine wherever you are It really doesn't matter how long how far I took my time and I realized You're the only thing that matters now in my life Just another song, while the beat goes on You keep on moving and I'll bring you the groove I guess it's just the way, nothing left to say Hard day everyday, DJ take me away If I tell you something now, I ask myself just how You came into my world, gotta keep on loving you So let the sun shine wherever you are It really doesn't matter how long how far I took my time and I realized You're the only thing that matters now in my life Stop, look, check, and listen I freaks the funk that will keep you wishing You're a superstar, no matter who you are You gotta keep ya dreams, because they're never too far Now can you see what I'm trying to do Realise that it's never too late now Can you feel what I'm trying to say And the beat goes on and on and on until the break of dawn If I tell you something now, I ask myself just how You came into my world, gotta keep on loving you So let the sun shine wherever you are It really doesn't matter how long how far I took my time and I realized You're the only thing that matters now in my life So let the sun shine wherever you are It really doesn't matter how long how far I took my time and I realized You're the only thing that matters now in my life So let the sun shine wherever you are It really doesn't matter how long how far I took my time and I realized You're the only thing that matters now in my life"
20000901,파이브,Battlestar,male,POP,-,-,-,-,"Yo I'm a battlestar knight like I'm jedi Rough to the tough but I'm sharper than the geam in your eye Galactic battlestar like I'm ready Ready for the 12 check get steady, on your marks set your best to throw you hands high Heads to the sky keep your eyes peeled listen for the sign A trip stage walk wire, I bring fire till I'm done you cause there can only be one How many times does it sound like this here we come again the microphone specialists Action time Take back the track rewind sing it for me one more time [Chorus:] If you feel the force throw your hands to the sky Put your hands up, get em' up, put your hands high If you wanna jump we can give you what you want Put your hands up, get em' up, put your hands high (2x) I lead the packs like Bruce Wayne leads da batz Rocking top hats with my verbal attacks yo when I raps boogie down can you hear the bell tower ring when you're time travelling from The funk that I bring fly wit me I'll take you higher when I'm walking over fire, come on follow the messiah I run jump skips over battle ships Doing lyrical back flips on the stage that I rips How many times does it sound like this Here we come again the microphone specialists action time take back the track rewind sing it for me one more time [Chorus] How many times does it sound like this Here we come again the microphone specialists action time take back the track rewind sing it for me one more time"
20000901,파이브,Don`t Fight It Baby,male,POP,-,-,-,-,"(Check it out) (Here we go) (Right) Why do you call up and fight with your feelings Girl weve been friends now for far too long I know some part of the things that I'm schemin' But there's no way I could do you wrong I said love was sayin' it ain't that Then you turn around and come back I can tell the way that you act That you want this Don't you fight it girl it's only natural You disguise what's in your eyes they say too much Don't deny that when we touch it's physical Let it be, you and me, don't fight it, baby Don't need to tell me we're riskin' this friendship But there's no stoppin' this vibe we're on And when we play I can feel we're not jokin' In every stare that we share too long ( ) What everybody knows (don't fight it baby) Just let you're feelings show (don't fight it baby) Don't wanna let it go (why fight it baby) Look to your heart and you'll know that you want it Baby you know you make me feel real hot Keep you body shakin' show me what you got (   )"
20000901,파이브,Keep On Movin`,male,POP,-,-,-,-,"I woke up today with this feeling That better things are coming my way (way) And if the sunshine has a meaning Telling me not to let things get in my way When the rainy days are dying Gotta keep on, keep on trying All the bees and birds are flying (ahh ahh ahh) Never let go, gotta hold on in Non-stop 'til the break of dawnin' Keep on movin' don't stop rockin' (ahh ahh ahh) Get on up when you're down Baby, take a good look around I know it's not much, but it's okay Keep on moving anyway Feels like I should be screaming Trying to get it through to my friends Sometimes it feels that life has no meaning But I know things will be alright in the end When the rainy days are dying Gotta keep on, keep on trying All the bees and birds are flying (ahh ahh ahh) Never let go, gotta hold on in Non-stop 'til the break of dawnin' Keep on movin' don't stop rockin' (ahh ahh ahh) Get on up when you're down Baby, take a good look around I know it's not much, but it's okay Keep on moving anyway When the rainy days are dying Gotta keep on, keep on trying All the bees and birds are flying (ahh ahh ahh) Never let go, gotta hold on in Non-stop 'til the break of dawnin' Keep on movin' don't stop rockin' (ahh ahh ahh) Get on up when you're down Baby, take a good look around I know it's not much, but it's okay Keep on moving anyway Get on up when you're down Baby, take a good look around I know it's not much, but it's okay Keep on moving anyway"
20000901,파이브,(Hidden Track),male,POP,-,-,-,-,-
20000901,파이브,If Ya Gettin` Down,male,POP,-,-,-,-,"If ya gettin' down baby, I want it now baby, Come and get it on baby, I want it now baby. I wanna take a little time to refresh your mind, Cause the boys are back in town with a different kind of funk, Who gots da funk? We gots da funk right, Everybody wanna boogie down tonight, Now throw your hands up in the sky, move em round from side to side. I got what it takes, the beat that brace the funky bass. I'll give your body crazy shakes (come on!). I heard somebody say (what?) She's at the party so (huh!) I'm gonna get me some (uhhhhhhh...) Chorus: If ya gettin' down, baby, I want it now, baby, Come and get it on, baby, I want it now, baby. If ya gettin' down, baby, I want it now, baby, Move it all around, baby, I want it now, baby. Wiggy, wiggy, I'm gettin' jiggy, Open up the door, I got the keys to your city, You're looking kind of pretty, dance til you drop, And don't stop til it goes 'POP'! Dance how you wanna dance, let's all get down while we got da chance. I've still got 12 seconds on the clock that's mine, And I ain't gonna stop until the sun don't shine. Line after line, I flow like rhyme after rhyme, just like the last time, Keep it up til you feel the heat, and get down once you hear the beat (uh uh) Bridge Chorus There ain't no problem that we can't fix, cause we can do it in the mix. Now if your man gives you trouble, we'll be there on the double. Guarenteed that we'll be hitting for six (c'mon yeah!). Bridge Chorus x 2"
20000901,파이브,Keep On Movin`,male,POP,-,-,-,-,"I woke up today with this feeling That better things are coming my way (way) And if the sunshine has a meaning Telling me not to let things get in my way When the rainy days are dying Gotta keep on, keep on trying All the bees and birds are flying (ahh ahh ahh) Never let go, gotta hold on in Non-stop 'til the break of dawnin' Keep on movin' don't stop rockin' (ahh ahh ahh) Get on up when you're down Baby, take a good look around I know it's not much, but it's okay Keep on moving anyway Feels like I should be screaming Trying to get it through to my friends Sometimes it feels that life has no meaning But I know things will be alright in the end When the rainy days are dying Gotta keep on, keep on trying All the bees and birds are flying (ahh ahh ahh) Never let go, gotta hold on in Non-stop 'til the break of dawnin' Keep on movin' don't stop rockin' (ahh ahh ahh) Get on up when you're down Baby, take a good look around I know it's not much, but it's okay Keep on moving anyway When the rainy days are dying Gotta keep on, keep on trying All the bees and birds are flying (ahh ahh ahh) Never let go, gotta hold on in Non-stop 'til the break of dawnin' Keep on movin' don't stop rockin' (ahh ahh ahh) Get on up when you're down Baby, take a good look around I know it's not much, but it's okay Keep on moving anyway Get on up when you're down Baby, take a good look around I know it's not much, but it's okay Keep on moving anyway"
20000901,파이브,Don`t Wanna Let You Go,male,POP,-,-,-,-,Dont wanna let you go We just wanna tell you Just wanna let you know That well stay around So what else can you do Youve said all you have to Were coming after you So dont make a sound I got this feelin Could it be theres someone watching over me Tell me who you are I close my eyes and count from nine To try and find some peace of mind But its gone too far You see our faces every time you turn your head around Well be watching even when you turn the lights down We will always be around No matter where you are Dont wanna let you go We just wanna tell you Just wanna let you know That well stay around So what else can you do Youve said all you have to Were coming after you So dont make a sound Im all alone now in the dark Just one chance so we can talk That is all I ask I close my eyes and then I dream I always wake up to a scream Wonder where you are Dont you know were always gonna be around you And there really isnt anything you can do We will always be around No matter where you are Dont wanna let you go We just wanna tell you Just wanna let you know That well stay around So what else can you do Youve said all you have to Were coming after you So dont make a sound
20000901,파이브,Everybody Get Up,male,POP,-,-,-,-,"everybody get up singing 1, 2, 3, 4, five will make you get down now everbody get up singing 1, 2, 3, 4, five will make you get down now you gots to keep it real you gots to keep it raw i'm lyrically blessed so don't try to ignore time forsom action creeping up your back and keep the beat nasty like fanet my reaction hard i'm addictive better lock your kids in comin to yu area ya don't know what you're missin go tell your family here comes the enemy blowin up the spot tech remedy CHORUS keep it move, keep it move, keep it move movin on i'll be the resident president, i'm the 5th element jimmy, fly, snooka stone cold is how i'm hittin em' better get together, put your hands in the sky stick em up punk hit em low hit me high now i'm the bad boy that you invite for dinners ain't got no manners cos i eat with my fingers lost boys terorise the neigmbourhood and mounds of the baskercille will be up to no good so come on come on everybody keep checking us cimin with the funk brin it on wickedness CHORUS everybody better recognise we got the funky rhymes keep it together, baby don't even try to otganise we be the trughnecks no concept no business we here to het down and ,ake em grab your hands so everybody, anybody, somebody put your hands together represent like john gotte paragraph after grammar for gas the party's armageddon hit em with the heavy class i'm buggin hittin with the hooligan bamn i know you wanna stand-up so baby jump CHORUS"
20000901,파이브,Got The Feelin`,male,POP,-,-,-,-,"Na na na na na nah Na na na na na na na nah (x4) Here we go again with the beats We got you heads bumping, now youre jumping from your seats If this is what youre wanting over there Throw your hands up in the air Cos you know we bring the sounds so unique Now everybodys moving, everybodys grooving Getting down with Five when we come your way Move it to the left now you shake it to the right Cos you know we gotta keep this party Pumping through the night Check me out now Bridge: Yo! 7,6,5,4,3,2,1 Im on the microphone, got you hot like the sun So a 1,2,3 now Im waiting on the 4 Kick down the door and turn it up a little more Chorus: If you got the feelin, jump to the ceiling Ah were getting down tonight 1 if you wanna, 2 if youre gonna, 3 cos everythings alright If you got the feelin, less of the dreaming Ah, were getting down tonight Its just round the corner, tell me if you wanna Five will make you feel alright Ah, move it at the back to the track We got it going on were the leaders of the pack Now if you feel right, hold it tight see, we wanna carry on cos we gonna take it through until the dawn Now everybodys moving, everybodys grooving getting down with 5 when we come your way So raise up your arms if we drop it on the 1 You see we're gonna carry on because the fun has just begun Check us out now! (Bridge) (Chorus) Oh oh oh oh oh oh oh Na na na na na nah Na na na na na na na nah (x4) (Chorus)"
20000201,파이브,Keep On Movin`,male,POP,-,-,-,-,I woke up today with this feeling That better things are coming my way And if the sunshine has a meaning Telling me not to let things get in my way When the rainy days are dying Gotta keep on keep on trying All the bees and birds are flying Never let go gotta hold on in Non stop 'til the break of dawnin' Keep on movin' don't stop rockin' Get on up when you're down Baby take a good look around I know it's not much but it's okay Keep on moving anyway Feels like I should be screaming Trying to get it through to my friends Sometimes it feels that life has no meaning But I know things will be alright in the end When the rainy days are dying Gotta keep on keep on trying All the bees and birds are flying Never let go gotta hold on in Non stop 'til the break of dawnin' Keep on movin' don't stop rockin' Get on up when you're down Baby take a good look around I know it's not much but it's okay Keep on moving anyway When the rainy days are dying Gotta keep on keep on trying All the bees and birds are flying Never let go gotta hold on in Nonstop 'til the break of dawnin' Keep on movin' don't stop rockin' Get on up when you're down Baby take a good look around I know it's not much but it's okay Keep on moving anyway Get on up when you're down Baby take a good look around I know it's not much but it's okay Keep on moving anyway Get on up when you're down Baby take a good look around I know it's not much but it's okay Keep on moving anyway Get on up when you're down Baby take a good look around I know it's not much but it's okay Keep on moving anyway Get on up I know it's not much
20050927,파이브,We Will Rock You (With Queen),male,POP,-,-,-,-,We're causin nutter devastation When we step in to the place And better believe that you can see We're gonna rock and never stop And here we go again Hit you with the flow again Kick it up the second time around We'll bring it on again Shout it out Buddy you're a boy Make a big noise playing in the street Gonna be a big man some day You got blood on your face big disgrace Kicking your can all over the place Singing we will we will rock you ha ha We will we will rock you How about a little something Get you in the mood Know what I mean Watch your back We got Queen on this track Bring the feedback and let it drop As long as Five bring the fun Queen bring the rock And they don't stop Buddy you're a young man Hard man selling in the street Gonna take on thw rodl some day You got blood on your face You big disgrace Waving your banner all over the place Singing we will we will rock you We're gonna rock we're gonna rock you baby we will we will rock you We're gonna we're gonna rock we're gonna ya we will we will rock you We're gonna rock we're gonna rock you baby we will we will rock you Go go go go go go go go go go Go go go go go go go go go go Go go go go Buddy you're an old man Poor man pleading with your eyes Gonna make you something some day You got mud on your face You big disgrace Somebody better put you back in your place Singing we will we will rock you We gonna rock we gonna rock you baby We will we will rock you yeah WA we will we will rock you We're gonna rock you we will we will rock you We gonna rock we gonna rock you baby we will we will rock you We're gonna rock you we will we will rock you we will we will rock you we will we will ROCK YOU
20021216,파이브,Let`s Dance (Radio Edit),male,POP,-,-,-,-,-
20021216,파이브,Slam Dunk (Da Funk),male,POP,-,-,-,-,-
20021216,파이브,Everybody Get Up (Radio Edit),male,POP,-,-,-,-,-
20021216,파이브,Shake,male,POP,-,-,-,-,-
20021216,파이브,That`s What You Told Me,male,POP,-,-,-,-,-
20021216,파이브,When the Lights Go Out (Radio Edit),male,POP,-,-,-,-,-
20021216,파이브,Hear Me Now,male,POP,-,-,-,-,-
20021216,파이브,All Around,male,POP,-,-,-,-,-
20021216,파이브,If Ya Gettin` Down,male,POP,-,-,-,-,-
20021216,파이브,Keep on Movin`,male,POP,-,-,-,-,-
20021216,파이브,Rock The Party (Single Remix),male,POP,-,-,-,-,-
20021216,파이브,Satisfied,male,POP,-,-,-,-,-
20021216,파이브,Take Your Chances On Me,male,POP,-,-,-,-,-
20021216,파이브,Straight Up Funk,male,POP,-,-,-,-,-
20020801,파이브,Keep On Movin`,male,POP,-,-,-,-,I look at today with this feeling That better things are coming my way And if the sunshine has a meaning Telling me not to let things get in my way When the rainy days are dying Gotta keep on keep on trying All the bees and birds are flying Never let go gotta hold on in Non stop 'til the break of dawnin' Keep on movin' don't stop rockin' Get on up when you're down Baby take a good look around I know it's not much but it's okay Keep on movin on anyway Feels like I should be screaming Trying to get it through to my friends Sometimes it feels that life has no meaning But I know things will be alright in the end When the rainy days are dying Gotta keep on keep on trying All the bees and birds are flying Never let go gotta hold on in Non stop 'til the break of dawnin' Keep on movin' don't stop rockin' Get on up when you're down Baby take a good look around I know it's not much but it's okay Keep on movin on anyway When the rainy days are dying Gotta keep on keep on trying All the bees and birds are flying Never let go gotta hold on in Non stop 'til the break of dawnin' Keep on movin' don't stop rockin' Get on up when you're down Baby take a good look around I know it's not much but it's okay Keep on movin on anyway Get on up when you're down Baby take a good look around I know it's not much but it's okay Keep on movin on anyway Get on up when you're down Baby take a good look around I know it's not much but it's okay Keep on movin on anyway Get on up when you're down Baby take a good look around I know it's not much but it's okay Keep on movin on anyway Get on up I know it's not much Get on up
