년도,가수,제목,남녀,장르,최고순위,작사가,작곡가,소속사,가사
20011203,파이브,We Will Rock You,male,POP,-,-,-,-,"Buddy you're a boy Make a big noise playin' in the street Gonna be a big man some day You got blood on your face, big disgrace Kicking your can all over the place Singing We will, we will rock you (ha ha) We will, we will rock you Keep the beat up, why, I'm gonna turn your heat up Gonna get you on the floor, gonna turn your feet up Rockin' you, like I never rocked you before Like the way I do, got you screamin' for more We're causin' utter devastation When we steppin' to the place You better believe that you can see We're gonna rock and never stop And here we go again Hit you with the flow again Kick it up the second time around we'll bring it on again - shout it up We will, we will rock you We will, we will rock you We will, we will rock you We will, we will rock you Go, go, go, go, go, go, go, go Buddy you're an old man, poor man, Pleading With you're eyes Gonna make you something some day You got mud on your face, big disgrace Somebody better put you back in your place singing We will, we will rock you (ha ha) We will, we will rock you (x10)"
20011203,파이브,Keep On Movin`,male,POP,-,-,-,-,"I woke up today with this feeling That better things are coming my way (way) And if the sunshine has a meaning Telling me not to let things get in my way When the rainy days are dying Gotta keep on, keep on trying All the bees and birds are flying (ahh ahh ahh) Never let go, gotta hold on in Non-stop 'til the break of dawnin' Keep on movin' don't stop rockin' (ahh ahh ahh) Get on up when you're down Baby, take a good look around I know it's not much, but it's okay Keep on moving anyway Feels like I should be screaming Trying to get it through to my friends Sometimes it feels that life has no meaning But I know things will be alright in the end When the rainy days are dying Gotta keep on, keep on trying All the bees and birds are flying (ahh ahh ahh) Never let go, gotta hold on in Non-stop 'til the break of dawnin' Keep on movin' don't stop rockin' (ahh ahh ahh) Get on up when you're down Baby, take a good look around I know it's not much, but it's okay Keep on moving anyway When the rainy days are dying Gotta keep on, keep on trying All the bees and birds are flying (ahh ahh ahh) Never let go, gotta hold on in Non-stop 'til the break of dawnin' Keep on movin' don't stop rockin' (ahh ahh ahh) Get on up when you're down Baby, take a good look around I know it's not much, but it's okay Keep on moving anyway Get on up when you're down Baby, take a good look around I know it's not much, but it's okay Keep on moving anyway"
20011203,파이브,If Ya Gettin` Down,male,POP,-,-,-,-,"If ya getting down baby I want it now baby Come and get it on baby I want it now baby I wanna take a little time To refresh your mind Coz the boyz are back in town With a different kinda funk Who's got da funk ?right! Everybody wanna boogie down tonight Now throw your hand up in the sky Move em from side to side I got what it takes The beats that brace the funky bass I'll Give your body craze shakes (come on) I heard somebody say (what?) She's at the party so (huh) Im gonna get me some (uhhhhhhhh) (Chorus) Wiggi wiggi I'm getting jiggi, open up the door, I got the keys to your city You're lookin' kinda pretty Dance til you drop and it don't stop until It goes pop Dance how you wanna dance Let's all get down while we got da chance I've still got 12 seconds on the clock That's mine And I aint gonna stop 'til the sun Don't shine Line after line I flow like rhyme after rhyme Just like time after time Keep it up til you feel the heat And get down once you feel the beat (uhhhhhhhh!) Keep it up til you feel the heat And get down once you feel the beat (uhhhhhhhh!) (Chorus) There ain't no problem that we can't fix Cos we can do it in the mix Now if your man gives you trouble We'll be there on the double Guaranteed we'll be hittin' for six (Come on) I heard somebody say (what?) She's at the party so (huh) Im gonna get me some (uhhhhhhhh) If ya getting down baby I want it now baby Come and get it on baby I want it now baby"
20011203,파이브,Everybody Get Up,male,POP,-,-,-,-,"everybody get up singing 1, 2, 3, 4, five will make you get down now everbody get up singing 1, 2, 3, 4, five will make you get down now you gots to keep it real you gots to keep it raw i'm lyrically blessed so don't try to ignore time forsom action creeping up your back and keep the beat nasty like fanet my reaction hard i'm addictive better lock your kids in comin to yu area ya don't know what you're missin go tell your family here comes the enemy blowin up the spot tech remedy CHORUS keep it move, keep it move, keep it move movin on i'll be the resident president, i'm the 5th element jimmy, fly, snooka stone cold is how i'm hittin em' better get together, put your hands in the sky stick em up punk hit em low hit me high now i'm the bad boy that you invite for dinners ain't got no manners cos i eat with my fingers lost boys terorise the neigmbourhood and mounds of the baskercille will be up to no good so come on come on everybody keep checking us cimin with the funk brin it on wickedness CHORUS everybody better recognise we got the funky rhymes keep it together, baby don't even try to otganise we be the trughnecks no concept no business we here to het down and ,ake em grab your hands so everybody, anybody, somebody put your hands together represent like john gotte paragraph after grammar for gas the party's armageddon hit em with the heavy class i'm buggin hittin with the hooligan bamn i know you wanna stand-up so baby jump CHORUS"
20011203,파이브,Let`s Dance (Radio Edit),male,POP,-,-,-,-,If you wanna dance this is our chance If you wanna dance let's take a chance Jiggy jump to the beat and Keep bouncing 30 seconds And counting hot one this choice Critical situation is difficult My calibre won't allow me To rhyme on a level where you people Can hear me see me guess I know You wanna be me in the meantime Bounce to the beat see music is my life 'Cause my life is music The beat of the drum in your heart Let's dance like you mean it Can't you feel it don't you know Let's dance 'cos you need it Better believe it here we go Let's dance give your all When we're coming together On the floor you know that You've got what I like check it down Dropping verbal bombs on the beat hoping That you people think this sound is unique 'Cause I like to party you like to party Come on everybody got to get it started I got something to get you jumpin' When I kick a freaky rhyme I get the dance floor thumpin' Just step back and take time to check When I rock up on the mic You people never forget So check it out music is my life 'Cause my life is music The beat of the drum in your heart Let's dance like you mean it Can't you feel it don't you know Let's dance 'cos you need it Better believe it here we go Let's dance give your all When we're coming together On the floor you know That you've got what I like Let's dance like you mean it Can't you feel it don't you know Let's dance 'cos you need it Better believe it here we go Let's dance give your all When we're coming together On the floor you know that You've got what I like~ If you wanna dance this is our chance If you wanna dance let's take a chance If you wanna dance this is our chance If you wanna dance let's take a chance You know that you've got what I like You know that you've got what I need You know that you've got what I like Music is my life 'cause my life Is music the beat of the drum in your heart Let's dance like you mean it Can't you feel it don't you know Let's dance 'cos you need it Better believe it here we go Let's dance give your all When we're coming together On the floor you know that You've got what I like Let's dance like you mean it Can't you feel it don't you know Let's dance 'cos you need it Better believe it here we go Let's dance give your all When we're coming together On the floor you know that You've got what I like Let's dance like you mean it Can't you feel it don't you know Let's dance 'cos you need it Better believe it here we go Let's dance give your all When we're coming together On the floor you know that You've got what I like~
20011203,파이브,Rock The Party,male,POP,-,-,-,-,"My time to burn so sit back and check the way I come through in the discotheque. I know you like what I got, my style, the original seventies dance floor hot new material. Name ain't down then you ain't coming in. Guest list on the door, you plus two friends, just as long as they female and got a fit ass, pole position never comin' in last. BRIDGE Bass line, yeah you know it's gonna get ya. Free your mind if the system will let ya. Peace time so it's time to shout. Guys in the back throw your hands about. CHORUS Rock the party. We can go through the night. If you're living it up we're gonna let ya. If you're giving it up we're gonna get ya. Rock the party. If you're feeling all right. When you're having a good time together and a Saturday night lasts forever. Yo can't hold me back, I rock the dance floor. Make a honey shake her booty so I kick it some more. You know the score how they rock a freaky move up on the spot never wanna stop, temperature is hot. Now visual contact I got all that make 'em boogy for me when I verbally freak that. Line after line, keep on hitting with my rhyme. Now what you gotta do is bring your body next to mine. Check it out. BRIDGE CHORUS Bass line is gonna get ya. On a Saturday night we're coming at ya. BRIDGE CHORUS x2"
20011203,파이브,Got The Feelin`,male,POP,-,-,-,-,"Na na na na na nah Na na na na na na na nah(x4) Here we go again with the beats We got you heads bumping, now you're jumping from your seats If this is what you're wanting over there Throw your hands up in the air Cos you know we bring the sounds so unique Now everybody's moving, everybody's grooving Getting down with Five when we come your way Move it to the left now you shake it to the right Cos you know we gotta keep this party Pumping through the night Check me out now BRIDGE: Yo! 7,6,5,4,3,2,1 I'm on the microphone, got you hot like the sun So A 1,2,3 now I'm waiting on the 4 Kick down the door and turn it up a little more If you got the feelin', jump to the ceiling Ah we're getting down tonight 1 if you wanna, 2 if you're gonna, 3 cos everything's alright If you got the feelin', less of the dreaming Ah, we're getting down tonight It's just round the corner, tell me if you wanna 5 will make you feel alright Ah, move it at the back to the track We got it going on we're the leaders of the pack Now if you feel right, hold it tight see, we wanna carry on cos we gonna take it through until the dawn Now everybody's moving, everybody's grooving getting down with 5 when we come your way So raise up your arms if we drop it on the 1 You see we're gonna carry on because the fun has just begun Check us out now! BRIDGE CHORUS Oh oh oh oh oh oh oh Na na na na na nah Na na na na na na na nah (x4) CHORUS"
20011203,파이브,When The Lights Go Out,male,POP,-,-,-,-,"[yea, like that] [you know what i mean] [you're lookin kinda fly tonight girl] [what's up] [check it] baby when the lights go out i'll show you what it's all about [comin at you girl, you know you loke this girl] [here we go] [check it] i ain't sorry for the way i feel i know you think i'm bein insincere from the way i'm treatin you i never wanted to be so unkind the only one thing on my mind is just kickin it with you girl baby it's not the way i feel you know you must believe me baby it's not part of the deal [oh no oh] CHORUS baby when the lights go out every single word can not express, the love and tenderness i;ll show you what its all about babe i swear you will succumb to me so baby come to me when the lights go out [yea check it] [check it out, second verse girl] i know you think it may be just a lie ain't no use in puttin up a fight cos my heart is set on you i see the truth its in your eyes i ain't fooled by your thin disguise i can see i'm gettin through babe girl don't deny the way you feel you know you've gotta trust me give me a chance to prove i'm real CHORUS RAP when i flick da switch make ya lips wanna dip now i can get you off cause i'm ready and equrpped now swin for me baby give me all that you got never wanna stop cos ya make me feel hot i know what you wanna do and dat i feel the same way too gove ya what ya wnat through the days and the nights yeh its about time that we turnedd out the lights"
20011203,파이브,Closer To Me,male,POP,-,-,-,-,"Closer To Me Constantly girl you're on my mind, and girl I think about you all of the time and even though words are hard to say, girl I miss you, never thought I'd feel this way. BRIDGE If you keep on taking, my heart you'll be breaking so why do you do this to me? You know how I'm feeling it's you I believe in baby can't you see that I need you? CHORUS You know that it's true. Every time I see your face I miss you baby You know that it's you. I want to let you know you're driving me crazy. I'd do anything to help you to see, I don't think you understand what you're doing to me. You know that it's true. Every now and then I want to call you baby. You know that it's you. I say a prayer that you'll come back to me lady. Oh yeah. Life ain't anything alone can't you see you're an angel in my eyes, everyday you're closer to me. Nobody's there when I call your name, and nights are cold girl without your flame. But if I could girl I'd make you see. That I'm sorry, and that I need you here with me. BRIDGE CHORUS Every day reminisce with the past of a love that we thought would last. How we used to be when it was you and me. How did it all disappear so fast. There are days that I can't forget there are things that I now regret. I was there for you when you were there for me, and I was thinkin' we were set. Every night when I'm laying in my bed I hear your voice going round in my head, think of all the things I could have done and all those things I could have said. I really will make it up to you I know now what I've got to do, It took time but now I've realised how much I'm missing you. CHORUS"
20011203,파이브,Until The Time Is Through,male,POP,-,-,-,-,"now and forever until the time is through i can't believe it i don't know where to start no baby so many questions deep inside my heart BRIDGE give me a moment before you go there's something you ouught to know CHROUS baby now and forever until the time is through i'll be standing here waitin and never give up my faith in you tryin to make it clear without your love i'd be half a man maybe one day you'll understand now and forever until the time is through i'll be waitin now can i tell you, so that you can see love has a meanin when you are here with me BRIDGE CHORUS there is no one to comfort me here in my cold reality i'm searchin for words what can i say to make you see baby now, until time is through, i'll be here [2x] CHORUS"
20011203,파이브,Don`t Wanna Let You Go,male,POP,-,-,-,-,Dont wanna let you go We just wanna tell you Just wanna let you know That well stay around So what else can you do Youve said all you have to Were coming after you So dont make a sound I got this feelin Could it be theres someone watching over me Tell me who you are I close my eyes and count from nine To try and find some peace of mind But its gone too far You see our faces every time you turn your head around Well be watching even when you turn the lights down We will always be around No matter where you are Dont wanna let you go We just wanna tell you Just wanna let you know That well stay around So what else can you do Youve said all you have to Were coming after you So dont make a sound Im all alone now in the dark Just one chance so we can talk That is all I ask I close my eyes and then I dream I always wake up to a scream Wonder where you are Dont you know were always gonna be around you And there really isnt anything you can do We will always be around No matter where you are Dont wanna let you go We just wanna tell you Just wanna let you know That well stay around So what else can you do Youve said all you have to Were coming after you So dont make a sound
20011203,파이브,Slam Dunk (Da Fuck),male,POP,-,-,-,-,"5ive bad boys with the power to rock you blowing your mind so you gotta get into 5ive what you waitin' four if you wanna three three two two one lets do it Do you wanna get freaky when the 5ive of us make one you gotta push the good vibe on if you really wanna feel it cause da flava in my song but i really need to know do you wanna get down do you wanna get funky do you wanna get down get on down Chorus Slam dunk da funk put it up (if you got that feelin') Slam dunk da funk put it up (if you got that feelin') Slam dunk da funk put it up (if you got that feelin') Slam dunk da funk (put it up) You gotta shoot, pass, slam baby time to set it off I'll be up, up away above the rim and hook a shoot ally oop baby, whoop, there it is and now I got ya three seconds left is just enough for me to rock ya check it now, how i flip it rock a beat 'cause I get with it and everybody wants to be a man with a hey, yipee, yo yippe four quarter slam everybody grab a party and just get on down Do you wanna get down Do you wanna get funky Do you wanna get down Get On down Repeat Chorus You wanna know what's hits you like a fork lift truck We got J, Ab, Rich, Sean and Scott rocking the extra Curricular ladies love particular fella Who knock da meter get the boom shake regular 5ive bad boys, honey no we don't quit 'til we hit the rebound sound with a kick so come on everybody everybody in tune as I boom shake 'N' rock a body Gimme room Clap your hands move your feet push it in pull it out to the beat Chorus (Repeat until end)"
20011203,파이브,It`s The Thins You Do,male,POP,-,-,-,-,-
20011203,파이브,When I Remember When,male,POP,-,-,-,-,"Oh... All the things I said, I should've said and didn't say and I wonder why, yes I wonder why I think about the time we spent the places that we went still makes me cry, yes it makes me cry Why do they say that time will heal this broken heart? They would know it isn't true If they lost someone like you oh Some things can never be replaced Some things aren't with me for always These are the things I will remember (When I remember when) I'd rather love and lose it all than never have you to recall These are the things I will remember (Again and again) Again and again When I remember when You taught me how to love why I'm all I am because of you, just because of you Everytime I lost my way You shine a light You made my day You see me through yes you see me through So who's gonna come around to heal this broken heart to show me how to laugh and cry but never how to say goodbye CHORUS Yes, life goes on, you carry on you do, and it's okay Yes love goes on and I will live to love another day Yes life goes on you carry on and you do it's okay I would laugh and I would cry But I will never say goodbye CHORUS Ooh...(ah)... When I remember when"
20011203,파이브,Inspector Gadget,male,POP,-,-,-,-,"VERSE 1 Go Mr Gadget go, that's the name Spell it out till it don't sound the same It's the G-A-D to the G-E-T Gadget on the mic wanna rock with me Yo stop that guy with a claw for a hand Go Mr Gadget with the master plan Inspect the scene of the crime Don't make me But I'll hit ya with a go Gadget rhyme BRIDGE When there's a problem in your town go Gadget now If you're in trouble there's no doubt he'll work it out CHORUS Inspector Gadget, oh If ya do the crime you're gonna do the time Inspector Gadget, oh When he's on the case ya better hide your face Inspector Gadget, oh The city's only saviour Inspector Gadget, oh He's number one VERSE 2 Now who's that man with a master plan To bring peace to the land ya gotta understand Inspector G's the name and law's the game He's gotta track down claw cuz the guy's insane So he works downtown as a ........... Looks kinda funny acts like the clown But he be gettin' criminals lock 'em in bars Go Gadget copter jet propeller cars He jumps up and out of the seat And bounces higher with the springs in his feet You know he'll always be around land or the sky And you know Inspector Gadget is a hell of a guy, c'mon BRIDGE When there's a problem in your town go Gadget now If you're in trouble there's no doubt he'll work it out CHORUS Inspector Gadget, oh He gotta badge on his chest and you know he's the best Inspector Gadget, oh Anywhere that ya hide Gadget'll find Inspector Gadget, oh The city's only saviour Inspector Gadget, oh He's number one BRIDGE When there's a problem in your town go Gadget now If you're in trouble there's no doubt he'll work it out CHORUS Inspector Gadget, oh If ya do the crime you're gonna do the time Inspector Gadget, oh When he's on the case ya better hide your face Inspector Gadget, oh The city's only saviour Inspector Gadget, oh He's number one Inspector Gadget, oh He gotta badge on his chest and you know he's the best Inspector Gadget, oh Anywhere that ya hide Gadget'll find Inspector Gadget, oh The city's only saviour Inspector Gadget, oh He's number one"
20011203,파이브,Set Me Free,male,POP,-,-,-,-,"You say I'm crazy but I don't have the time  (Stargate... uh Five!)  You say I'm crazy but I don't have the time  (Yeah...C'mon!)  (I, I, I...)  I have been running around all after you  (You, you, you...)  You have been playing me for a fool  (My, my, my...)  My situation's got me all confused  (Why, why, why?)  Why should I be holding out for you?  [BRIDGE]  We... could have been so easily  Ow-www! It's hurting me, can't you see?  [CHORUS]  You say I'm crazy but I don't have the time  I'm insane lately 'cause you're always on my mind  I can't always be what you want me to be  If I'm not for you...  Then baby set me free  (Set me free, yeah...C'mon!)  (I, I, I...)  I have been thinking of you constantly  (You, you, you...)  You got me thinking of you sexually  (My, my, my...)  My lonely nights...  (Why, why, why?)  'Cause all I wanna do is you  [BRIDGE]  [CHORUS]  There will come a time  You will be mine  Baby, I feel it deep inside  I'm begging you, please  Get down on your knees  'Cause I wanna rock you all night long  (Rock you all night long...)  Yeah, yeah, yeah, yeah...  (Yeah...C'mon!)  (I'm gonna rock you all night long...)  [CHORUS x 2]"
20011203,파이브,Keep On Movin`,male,POP,-,-,-,-,"I woke up today with this feeling That better things are coming my way (way) And if the sunshine has a meaning Telling me not to let things get in my way When the rainy days are dying Gotta keep on, keep on trying All the bees and birds are flying (ahh ahh ahh) Never let go, gotta hold on in Non-stop 'til the break of dawnin' Keep on movin' don't stop rockin' (ahh ahh ahh) Get on up when you're down Baby, take a good look around I know it's not much, but it's okay Keep on moving anyway Feels like I should be screaming Trying to get it through to my friends Sometimes it feels that life has no meaning But I know things will be alright in the end When the rainy days are dying Gotta keep on, keep on trying All the bees and birds are flying (ahh ahh ahh) Never let go, gotta hold on in Non-stop 'til the break of dawnin' Keep on movin' don't stop rockin' (ahh ahh ahh) Get on up when you're down Baby, take a good look around I know it's not much, but it's okay Keep on moving anyway When the rainy days are dying Gotta keep on, keep on trying All the bees and birds are flying (ahh ahh ahh) Never let go, gotta hold on in Non-stop 'til the break of dawnin' Keep on movin' don't stop rockin' (ahh ahh ahh) Get on up when you're down Baby, take a good look around I know it's not much, but it's okay Keep on moving anyway Get on up when you're down Baby, take a good look around I know it's not much, but it's okay Keep on moving anyway"
20011203,파이브,Five Greatest Hits Megamix,male,POP,-,-,-,-,-
